CIN,Company Name,Status
U72900OR2021PTC036277,IPREDICT RENEWABLES PRIVATE LIMITED,Active
U80903UP2021PTC145412,TRISHANT ACADEMY PRIVATE LIMITED,Active
U72900TN2021PTC141861,INAIPLE PRIVATE LIMITED,Active
U36990GJ2020PTC119239,ROSPAR JEWELLERY EXPORTS PRIVATE LIMITED,Active
U72900CT2021PTC011393,ITHILIEN TECHNOLOGIES PRIVATE LIMITED,Active
U74140HR2021PTC094230,AVI ADI ADVISORS PRIVATE LIMITED,Active
U51909TZ2020PTC035287,KANVEEN ENTERPRISES PRIVATE LIMITED,Active
U63000KL2020PTC066713,ROHINI INNOVATIONS AND SOLUTIONS PRIVATE LIMITED,Active
U80902KA2020PTC142803,CODEZI HEALTHCARE SOLUTIONS PRIVATE LIMITED,Active
U62200MH2020PTC352731,ASOTA CARGO PRIVATE LIMITED,Active
U93000KA2019PTC120071,SELDOM INTERIORS PRIVATE LIMITED,Active
U92410TZ2019PTC031482,VETRIVA SPORTS ACADEMY PRIVATE LIMITED,Active
U70200UP2019PTC112005,RAMBHASHREE REAL ESTATE PRIVATE LIMITED,Active
U74999KA2018PTC109291,CREIXER MARKETING PRIVATE LIMITED,Active
U24299GJ1977PTC003072,NANDESARI RASAYANEE PRIVATE LIMITED,Active
U15490AP2019PTC110204,SIRI ALMONDS PRIVATE LIMITED,Active
U18202WB2019PTC229756,CAZZKARO BRANDS PRIVATE LIMITED,Active
U37100RJ2018PTC059989,APAURUSHEYA ENTERPRISES PRIVATE LIMITED,Active
U74999MH2018PTC303890,MOOL URJA AND ENVIRONMENT PRIVATE LIMITED,Active
U72900KA2019PTC120374,WEVONIX INNOVATION PRIVATE LIMITED,Active
U45400KA2019PTC120354,OPES TERRAE INFRA VENTURES PRIVATE LIMITED,Active
U93090PN2018PTC177625,ZEALBIZ MEDIA AND MARKETING PRIVATE LIMITED,Active
U52310HR2019PTC077895,ZEN LIFE PHARMACIA PRIVATE LIMITED,Active
U74999TN2019PTC126938,VANSAN MOVIES PRIVATE LIMITED,Active
U45309GJ2019PTC106103,THC IMPACT VENTURES PRIVATE LIMITED,Active
U29299MH2018PTC311705,DWARIKADHEESH AUTOMOTIVE PRIVATE LIMITED,Active
U72900DL2018PTC328282,ANTRIEX IT SERVICES PRIVATE LIMITED,Active
U74999RJ2019OPC063676,MANGHRANI WARE HOUSE (OPC) PRIVATE LIMITED,Active
U74999MH2019PTC319795,GAUTAMVILLA ECOSTAYS PRIVATE LIMITED,Active
U24110KA2018PTC110829,INM NUVENT PAINTS PRIVATE LIMITED,Active
U65999KL2018PLC051694,SREEPADMANABHA NIDHI LIMITED,Active
U74999PB2019PTC048945,WESTONEL FARMSTAY PRIVATE LIMITED,Active
U51100WB2016PTC217555,DEFINITE TRADE INTERNATIONAL PRIVATE LIMITED,Active
U15130TN2019PTC127082,ANUGRAHA SPICES PRIVATE LIMITED,Active
U36990KA2019PTC120761,AIYON PRODUCTS PRIVATE LIMITED,Active
U80904KL2018PTC051741,EDCOR EDUCATIONAL INSTITUTION PRIVATE LIMITED,Active
U67190MH2018PTC311838,ARGON CAPITAL ADVISORS PRIVATE LIMITED,Active
U74999PN2019PTC181749,HUSTLERS ONLINE SERVICES PRIVATE LIMITED,Active
U74900DL2009PTC336506,KAY THREE ENTERPRISES PRIVATE LIMITED,Active
U20100WB2012PTC184148,ANISHS PROGRAMMING PRIVATE LIMITED,Active
U01100DL2018PTC328547,NUPUR POLYHOUSES FABRICATION AND INSTALLATIONS PRIVATE LIMITED,Active
U51909HR2019PTC078180,BIRDSNEST TRADING PRIVATE LIMITED,Active
U45403KA2019PTC120915,BNN PROJECTS PRIVATE LIMITED,Active
U67120MH2019FTC320358,SCLOWY ASSET RECONSTRUCTION PRIVATE LIMITED,Active
U29300DL2018PTC328545,DEVIANI FARM EQUIPMENT MANUFACTURERS PRIVATE LIMITED,Active
U74999GJ2019PTC106326,SYNDEO EXIM PRIVATE LIMITED,Active
U23209DL2018PTC328657,SDM LUBIMAX INDIA PRIVATE LIMITED,Active
U45309TG2018PTC121941,ZENOID INTERIOR & INFRA PROJECTS PRIVATE LIMITED,Active
U85300HR2019PTC078386,ALLERFREE HEALTHCARE PRIVATE LIMITED,Active
U74999MH2018PTC304482,AAUXILIUM MEDTEK PRIVATE LIMITED,Active
U18109UP2019PTC113496,UDYAAN DESIGNER STORE PRIVATE LIMITED,Active
U74990KA2019PTC121242,TRAVIS BICKLE PRIVATE LIMITED,Active
U52100UP2017PTC097230,KPDP BUSINESS SOLUTIONS PRIVATE LIMITED,Active
U74999MH2019PTC320920,THINK ARTZORB PRIVATE LIMITED,Active
U52609PN2019PTC185622,BEING HAPPY CLINIC PRIVATE LIMITED,Active
U70109TG2019PTC130544,ACRES INDIA PRIVATE LIMITED,Active
U63040RJ2019PTC063983,GHOOMLE TRAVEL SERVICES PRIVATE LIMITED,Active
U74999MH2018OPC304557,ARG ASSESSMENTS (OPC) PRIVATE LIMITED,Active
U74999TG2018PTC121985,SITARAM VISA CONSULTANTS PRIVATE LIMITED,Active
U74999KA2019PTC121659,SOFTGAMI TECHNOLOGIES PRIVATE LIMITED,Active
U29299UP2019PTC113895,SAMVAD HEARING SOLUTION PRIVATE LIMITED,Active
U72900HR2019PTC078749,AYSEA TECHNOLOGY AND SOFTWARE PRIVATE LIMITED,Active
U29305PN2019PTC182448,ADVIK TECHNO PRODUCTS PRIVATE LIMITED,Active
U80904PN2018PTC177743,QLEAP ACADEMY PRIVATE LIMITED,Active
U74999UP2019PTC114094,TAXBOXINDIA PRIVATE LIMITED,Active
U70100UP2019PTC114146,ROHINI PARADISE PRIVATE LIMITED,Active
U15549GJ2018PTC103307,HKN OIL INDUSTRIES PRIVATE LIMITED,Active
U24290UP2019PTC114195,EN-VITRO HEALTHCARE PRIVATE LIMITED,Active
U63032WB2018PTC224622,SHIBU AND AVISEK MONEY CHANGERS PRIVATE LIMITED,Active
U55101AP2019PTC111356,CHIRRAYANAM GAYATHRI HEAVENLY BEACH RESORTS PRIVATE LIMITED,Active
U27320GJ2019OPC106907,VOLFVEL CORROTECH (OPC) PRIVATE LIMITED,Active
U72900HR2019OPC078907,ALGORITHM BUSINESS INNOVATION (OPC) PRIVATE LIMITED,Active
U74999TN2019PTC127879,BHASKAY ENGINEERING CONSULTING AND CONTRACTING PRIVATE LIMITED,Active
U74999HR2019PTC078960,ACOMMUNE TECHNOLOGIES PRIVATE LIMITED,Active
U17299GJ2018PTC101793,SPECIFIC DENIM PRIVATE LIMITED,Active
U55209MH2019PTC322573,PHOENIX INFRA RESIDENCY PRIVATE LIMITED,Active
U24299PN2022PTC209484,SNEVIMED PHARMACEUTICAL PRIVATE LIMITED,Active
U72501HR2022PTC106384,RRIJU PRODSERV PRIVATE LIMITED,Active
U63022AP1995PTC021182,RANGARAJU AGROS PRIVATE LIMITED,Active
U29195TG1993PTC016206,SANGHI PACKAGING PVT LTD,Active
U01119TG1999PTC031042,VISWAM SEEDS PRIVATE LIMITED,Active
U80302TG2003PTC041886,JEEVAS EDUCATIONAL ACADEMY PRIVATE LIMITED,Active
U45201TZ2019PTC032063,SAMY PROJECTS PRIVATE LIMITED,Active
U72200TG1997PTC027954,VEDA INSTITUTE OF INFORMATION TECHNOLOGY PRIVATE LIMITED,Active
U65999TN2022PLN155167,VNB IBM NIDHI LIMITED,Active
U63090GJ2022PTC135285,A K MARITIME PRIVATE LIMITED,Active
U72400TG2004PTC044465,LORVIN COMPUTECH PRIVATE LIMITED,Active
U35999GJ1979PTC003354,CHIMERA HOLDINGS PRIVATE LIMITED,Active
U24231GJ1979PTC003542,PAMRAT CHEMICALS PRIVATE LIMITED,Active
U45200BR2001PTC009698,MEMAAR BUILDERS & EXPORTERS PRIVATE LIMITED,Active
U65910GJ1980PTC003833,AEROLITE INVESTMENT PVT LTD,Active
U65910GJ1980PTC003834,AGATE INVESTMENTS PVT LTD,Active
U54940GJ1992PTC018751,SUMAN TRADES PRIVATE LIMITED,Active
U45201GJ1995PTC026663,LAND MARK FINSTOCK PRIVATE LIMITED,Active
U27107ML1996PLC008270,SHREE SANYEEJI STEELS LTD,Active
U60300WB2022PTC257052,DEANGEL AUCTUS PRIVATE LIMITED,Active
U15311AS1975PTC001638,SIKARIA SONS PRIVATE LTD,Active
U70101AS1980PTC001858,D S KOTHARI PVT LTD,Active
U74999MH2022PTC390185,VARSHDEEP TECHNOLOGIES INDIA PRIVATE LIMITED,Active
U85300MH2022PTC390095,PW HEALTHCARE PRIVATE LIMITED,Active
U45202GJ2000PTC037311,SHANTI BUILD-WELL PRIVATE LIMITED,Active
U31100GJ1995PTC027305,BARODA FAB ENGINEERS PVT LTD,Active
U45201GJ1995PTC027863,PATEL CONSTRUCTION COMPANY PRIVATE LIMITED,Active
U29260GJ2005PTC045889,R M HEALDS PRIVATE LIMITED,Active
U26941GJ2004PTC043708,SHREE PARSHVANATH CEMENT PRIVATE LIMITED,Active
U51494GJ2005PTC046057,ADVENT TRADELINK PRIVATE LIMITED,Active
U15142GJ1991PTC016278,DURGA RICOL INDUSTRIES PRIVATE LIMITED,Active
U25199HR1999PTC034300,ATAM RUBBERS PRIVATE LIMITED,Active
U31300GJ1988PTC011317,POLYCOT CABLES PRIVATE LIMITED,Active
U01111HR1999PLC034107,JAGAT AGRICULTURE AND FOREST LTD,Active
U64120GJ2005PTC046493,SUBH EXPRESS COURIER PRIVATE LIMITED,Active
U51909GJ2003PLC042011,SPG CHEMICAL INDUSTRIES LIMITED,Active
U67120GJ2001PTC039274,TIRTHRAJ SECURITIES PRIVATE LIMITED,Active
U64120KA1996PTC019802,FREIGHT LINKS PRIVATE LIMITED,Active
U02812KA1988PTC020510,D' RANFLEX INDIA PRIVATE LIMITED,Active
U85110KA1993PTC014343,JOYERIA JEWELS INDIA PRIVATE LIMITED,Active
U30007KA1999PTC025678,EAITEC SOLUTIONS PRIVATE LIMITED,Active
U30007KA1998PTC023579,LAKE SYSTEMS PRIVATE LIMITED,Active
U72200KA2000PTC027982,ARCOT R AND D SOFTWARE PRIVATE LIMITED,Active
U72100KA1997PTC022476,OASYS SOFTWARE SOLUTIONS PRIVATE LIMITED,Active
U25209KA1996PLC020922,RATNA POLYPACK (INDIA) LIMITED,Active
U92411KA2005PTC037501,WHITE PEACOCK SPORTS PRIVATE LIMITED,Active
U65992KL1980PTC003252,KALINGA CHIT FUNDS PVT LTD,Active
U74999KA1983PTC005627,SAHYADRI ARECANUT COMPANY PRIVATE LIMITED,Active
U02221KA1987PTC008406,SHISHIRA PRINTS PRIVATE LIMITED,Active
U51900KA2022PTC166043,SLT LIFESCIENCE PRIVATE LIMITED,Active
U51506KA1988PTC009513,COMPUTER MARKETING AND ALLIED SERVICES PRIVATE LIMITED,Active
U29120KA1989PTC010295,GEARED HYDROPOWER PRIVATE LIMITED,Active
U19129KL1991PTC005939,COCHIN LEATHERS PVT LTD,Active
U22110KL1998PTC012645,DAHLIA PUBLISHERS PRIVATE LIMITED,Active
U15490KA2022PTC166332,CLOCK-WISE VENTURES PRIVATE LIMITED,Active
U15549UP2022PTC171112,NORTHERN LIGHTS BEVERAGES PRIVATE LIMITED,Active
U51432KL1999PTC012826,KNO-WELL CERAMICS PRIVATE LIMITED,Active
U74210KA2002PTC030173,CLEARWATER TECHNOLOGY SERVICES PRIVATE LIMITED,Active
U52599KL1988PTC005240,ASIAN HOME PRODUCTS PVT LTD,Active
U51219KA2002PTC030065,ALTERNATIV FOOD PROCESS PRIVATE LIMITED,Active
U73100KA2004PTC034268,TERRA INCOGNITUS SYSTEMS RESEARCH ALLIANCE PRIVATE LIMITED,Active
U74210KA2003PTC032865,KYONGNAM SUNGHOON CONSULTANCY SERVICES PRIVATE LIMITED,Active
U15127KL1998PTC012294,IRIS CONDIMENTS PRIVATE LIMITED,Active
U27107CT1998PTC012814,SAURABH STRIPS PRIVATE LIMITED,Active
U60231CT2005PTC017232,SINGH ROADWAYS PRIVATE LIMITED,Active
U67120MH1980PTC023062,SARDESAI HOLDINGS PRIVATE LIMITED,Active
U28920MH1979PTC021251,HYLPRES TECHNIK ENGINEERING COMPANY PRIVATE LIMITED,Active
U72200PN2022PTC214757,DEALERPAAS PRIVATE LIMITED,Active
U24110MH1982PTC026783,AMOD CHEMICALS PVT LTD,Active
U85300GJ2022PTC135517,ADITI HEALTH SCIENCES PRIVATE LIMITED,Active
U74140MH1973PTC016323,ABDULHUSEIN MULLA MOHAMEDALLY PRIVATE LIMITED,Active
U85300KA2022PTC166161,REVIVO HEALTH PRIVATE LIMITED,Active
U51909PN1987PTC045487,ABHIJEET SURFACE COATINGS PRIVATE LIMITED,Active
U45200MH1988PTC046423,POOJA PROPERTIES PRIVATE LIMITED,Active
U10100MH1974PTC017193,ARUNODAYA MINERALS PRIVATE LIMITED,Active
U13993MH1968PTC013993,INDUSTRIAL ELECTRICAL PRODUCTS PRIVATE LIMITED,Active
U45209MH1988PTC049597,PLUS PROPERTY MANAGERS PRIVATE LIMITED,Active
U24110MH1989PTC050621,ZENITH CHEMICALS PRIVATE LIMITED,Active
U74140MH1989PTC051950,SAGAR MANAGEMENT SERVICES PRIVATE LIMITED,Active
U63022MH1990PTC055549,PREMIER CHILLERS PRIVATE LIMITED,Active
U24220MH1989PTC052755,KIRAN PAINTS PVT LTD,Active
U27100UP2022PTC170951,P. R. CEILING PRODUCTS PRIVATE LIMITED,Active
U74140MH1990PTC058858,BIOREX BIOSCIENCES PRIVATE LIMITED,Active
U45202PN1987PTC043384,GHARAPURAY CONSTRUCTIONS PVT LTD,Active
U65990MH1990PTC059510,HARISH FISCAL SERVICES PRIVATE LIMITED,Active
U17120MH1991PTC060893,DEVENDRA KIRTI SILK MILLS PRIVATE LIMITED,Active
U15140MH1992PTC067087,SAMYOG FOODS PRIVATE LIMITED,Active
U17100MH1990PTC059570,SAMRATH SILK MILLS PRIVATE LIMITED,Active
U45200MH1992PTC069995,AMBAR ERECTORS PRIVATE LIMITED,Active
U40105MH1992PTC068389,DROLIA COMFORT PACKAGING PRIVATE LIMITED,Active
U55200MH1986PTC041357,PLATINUM HOTELS PRIVATE LIMITED,Active
U70100MH1987PTC042542,MANKANIS BUILDERS AND DEVELOPERS PRIVATE LIMITED,Active
U55101MH1993PTC075138,PLEASANT HOTELS AND RESORTS PRIVATE LIMITED,Active
U74994MH1993PTC073041,LITOLIER INTERIORS PVT LTD,Active
U92110MH1991PLC064110,SEVEN BROTHERS FILMS (INDIA) LIMITED,Active
U24110MH1992PTC065467,KAFER ENGINEERING PVT LTD,Active
U91990MH1995PTC091040,ADITYA EXPOSITION PRIVATE LIMITED,Active
U85100HR2022PTC106835,MEDANGEL HEALTHCARE PRIVATE LIMITED,Active
U72400MH1992PTC064924,ALPHA SHARE SERVICES PVT LTD,Active
U51909MH1996PTC101113,YASH-LAXMI INTERNATIONAL PRIVATE LIMITED,Active
U63090MH1996PLC100022,SAIVENK SHIPPING AND AGENCIES LIMITED,Active
U51900MH1995PTC093318,WINDSOR OVERSEAS PRIVATE LIMITED,Active
U67120MH1996PTC100752,KANDLA EQUITIES PRIVATE LIMITED,Active
U31300MH1995PLC092947,PATLIPUTRA INTERNATIONAL TRADING LIMITED,Active
U51909MH1995PTC089548,TANDON COMPUTERS (INDIA) PRIVATE LIMITED,Active
U74140MH1996PTC104000,MANAS MANAGEMENT SERVICES PRIVATE LIMITED,Active
U17120MH1997PTC105599,SKM APPARELS PRIVATE LIMITED,Active
U67110MH1998PTC115122,ETHEREAL JEWELLERY PRIVATE LIMITED,Active
U72100MH1999PTC121058,MOBILE SYSTEMS INDIA PRIVATE LIMITED,Active
U51909MH2001PTC134066,J K EXIM PRIVATE LIMITED,Active
U24231DL2001PTC186327,RECKON PHARMACHEM PRIVATE LIMITED,Active
U18101MH2000PTC125497,KESHAVLAL MOHANLAL AND COMPANY TEXTILES PRIVATE LIMITED,Active
U74210PN1997PTC110980,PRAASAD ARCHITECTS AND TOWNPLANNERS PRIVATE LIMITED,Active
U30007MH2000PTC129097,KAMDHENU HI-TECH PAPERS PRIVATE LIMITED,Active
U36911MH2000PTC124966,STONES AND JEWELLERY (INDIA) PRIVATE LIMITED,Active
U51900MH2000PTC126386,PINE DERIVATIVES MARKETING PRIVATE LIMITED,Active
U51900MH1999PTC119968,GOPESH IMPEX PRIVATE LIMITED,Active
U22110MH2000PTC123721,ASHOK PRAKASHAN PRIVATE LIMITED,Active
U26943PB1985PTC006163,PUNJAB ASBESTOS PVT LTD,Active
U20100PN2022PTC214952,MAAYBA TOYS PRIVATE LIMITED,Active
U24110MH1998PTC112931,SATYAKI CHEMICAL PRIVATE LIMITED,Active
U33201MH1997PTC110990,FOCAL VISION INTERNATIONAL PRIVATE LIMITED,Active
U72200MH1998PTC113345,SAI INFORMATION SYSTEMS PRIVATE LIMITED,Active
U25111PB1993PTC013635,S K SACKS PVT LTD,Active
U55101PB1996PLC018418,SANTA BANTA NET LIMITED,Active
U02001OR1993PLC003268,DEASIA TEAK PLANTATIONS LTD.,Active
U27109PB1998PTC021528,K C SONI AND SONS STEELS PRIVATE LIMITED,Active
U74940RJ1996PTC011896,POPULAR OFFSET SERVICES PVT LTD,Active
U85110RJ2002PTC017567,DR. VYAS NURSING HOME AND RESEARCH CENTRE PRIVATE LIMITED,Active
U72100RJ2000PTC016546,JAI BHIKSHU HARDWARE PRIVATE LIMITED,Active
U18101RJ1996PTC012667,SHALIGRAM TREXIM PRIVATE LIMITED,Active
U51102RJ1995PLC010149,SHILPA MECHTRAD LTD,Active
U25201RJ1994PTC008224,RAJASHREE POLYMERS PRIVATE LIMITED,Active
U14101RJ1995PTC010598,ASHISH MARMO PRIVATE LIMITED,Active
U55101TN1988PLC015585,MANIPAL HOTELS LTD.,Active
U85110RJ1988PTC004674,TELA DENTAL CLINIC AND RESEARCH CENTRE PRIVATE LIMITED,Active
U15141RJ1993PTC007403,ARIHANT VANASPATI PRIVATE LIMITED,Active
U67200TN2002PTC048925,ALLFIN DISTRIBUTIONS PRIVATE LIMITED,Active
U51224TN2001PTC048228,ALAMADHI AQUA & AGRO PRIVATE LIMITED,Active
U74120UP1976PTC004240,CHANDRA SNACKS PRIVATE LIMITED,Active
U21093TN1998PTC040820,CORRUBOX PACKAGING PRIVATE LIMITED,Active
U67190TN2004PTC054775,SSS FOREXX PRIVATE LIMITED,Active
U27106TN2004PTC053821,LOGOS ENGINEERING PRIVATE LIMITED,Active
U65991TN1996PLC035199,SRI KANNIKA PARAMESWARI BENEFIT FUND LIMITED,Active
U74140TN2004PTC053029,BIGBEN CONSULTANTS PRIVATE LIMITED,Active
U17115TN2003PTC052235,RADHA SHYAM MILLS PRIVATE LIMITED,Active
U18101TN2004PTC054876,MAHTANI CLOTHING COMPANY PRIVATE LIMITED,Active
U67200TN2003PTC050550,ALLFIN INSURANCE SERVICES PRIVATE LIMITED,Active
U51505TN2002PTC049271,RESHMA ELECTRIC PRIVATE LIMITED,Active
U24117TN1997PTC037887,EMMES MANURE MILLS PRIVATE LIMITED,Active
U36999TN1998PTC039838,POLYCORE PROCESS CONVEYOR BELTING PRIVATE LIMITED,Active
U85110UR2005PTC030086,CENTRONIC (INDIA) DIAGNOSTICS PRIVATE LIMITED,Active
U15122UP2004PLC028568,KAIL AGRO INDUSTRIES LIMITED,Active
U36911UP2003PTC027447,TRA JEWELS PRIVATE LIMITED,Active
U01134TZ1995PLC005868,VEENA ORCHARDS AND FARMS LIMITED,Active
U52334UP2002PTC026763,MULTIVISION SYSTEMS PRIVATE LIMITED,Active
U55101WB1982PTC034675,WELCOMGROUP HOTELS PVT LTD,Active
U22219WB1985PTC039782,KAYDEE PAINTS PVT LTD,Active
U51491WB1982PLC035456,SAMPAT INDUSTRIAL & CONSTRUCTION CO LTD,Active
U65921WB1984PTC041474,RAJYOG INVESTMENTS PVT LTD,Active
U01119WB1986PLC041142,GANPATI RICE INDUSTRIES LTD,Active
U70100WB1986PTC041604,MOH-MANTHAN DEVELOPERS PRIVATE LIMITED,Active
U29298WB1993PTC058420,RECORD MACHINERIES PVT LTD.,Active
U51219WB1995PTC067385,H V MARKETING PVT LTD,Active
U51909WB1990PTC049322,SAMRAT MERCANTILE PVT LTD,Active
U51909WB1990PTC049795,AVO ELECTRO CONTROL SYSTEMS PVT LTD,Active
U74140WB1996PTC076662,SHEEMEE SALES & SERVICES PVT LTD,Active
U72900DL2016PTC304113,NS CONSTRUCTION SOLUTIONS PRIVATE LIMITED,Active
U70101WB2005PTC103114,AKSHARA HOMES PRIVATE LIMITED,Active
U45203WB2004PTC098968,MAXLUX MET-CAST PRIVATE LIMITED,Active
U70101WB2005PTC103111,RAKTADANTIKA HOMES PRIVATE LIMITED,Active
U51109WB2005PTC102991,DIWAKAR AGENCIES PRIVATE LIMITED,Active
U26942WB2005PTC101932,AMRIT CEMENT MFG CO PRIVATE LIMITED,Active
U70101WB2005PTC103115,RAKTADANTIKA CONSTRUCTIONS PRIVATE LIMITED,Active
U92131PN2004PTC019060,DREAMS TELEFILMS AND PUBLICATIONS PRIVATE LIMITED,Active
U74300PN2000PTC014410,CLASSIC PUBLICITY PRIVATE LIMITED,Active
U51109WB2000PTC092434,APEX DEALERS PRIVATE LIMITED,Active
U74899DL1947PTC001250,RAM NARAIN SATYA PAUL PRIVATE LIMITED,Active
U74899DL1980PTC010721,KASIDA PRIVATE LIMITED,Active
U74899DL1971PTC005511,USHA ELECTRONICS (INDIA) PRIVATE LIMITED,Active
U74899DL1979PTC009780,CAMPAIGN ADWAYS PRIVATE LIMITED,Active
U74899DL1986PTC025186,WELCURE PHARMACEUTICALS PRIVATE LIMITED,Active
U29302DL1981PTC012106,S J S CYLINDRS PRIVATE LIMITED,Active
U74899DL1988PTC030436,CHAIKA EXPORTS PRIVATE LIMITED,Active
U74899DL1986PTC024607,VINEET ESTATES PRIVATE LTD,Active
U74899DL1986PTC026038,PRAGMACS CONSULTANTS PRIVATE LTD,Active
U74899DL1987PTC028913,INVITRO MEDICAL SOLUTIONS PRIVATE LIMITED,Active
U74899DL1990PTC042063,DHANAURIA INVESTMENTS PRIVATE LIMITED,Active
U74899DL1989PTC037933,AHUJA BROTHERS PRIVATE LIMITED,Active
U74899DL1989PTC038350,MEDRONAS PHARMACEUTICALS PRIVATE LIMITED,Active
U70102DL1993PTC053887,SHIV SHAKTI HOLDINGS PRIVATE LIMITED,Active
U74899DL1994PTC057152,MAHAMAYA BUSINESS PRIVATE LIMITED,Active
U74899DL1993PTC053389,JEEWAN HEART & MEDICAL RESEARCH CENTRE PRIVATE LIMITED,Active
U74899DL1993PTC053951,SHANTRU FARMS PRIVATE LIMITED,Active
U74899DL1995PTC071641,SERVEPRIYA TRADING AND BUILDERS PRIVATE LIMITED,Active
U74899DL1995PTC072306,SONAMIT AGRO FARMS AND INVESTMENT PRIVATE LIMITED,Active
U74899DL1995PTC073410,NAVISHA (INDIA ) PVT LTD,Active
U24117DL1996PLC075129,KANDLA PETRO CHEMICALS CORP LIMITED,Active
U51909DL1990PTC041938,HE TRADERS PRIVATE LIMITED,Active
U67120DL1996PTC077433,GROW MORE HOLDINGS PRIVATE LIMITED,Active
U74899DL1994PTC059561,PRITHA OFFSETS PRIVATE LIMITED,Active
U01122DL1996PTC079494,ABC MEDICO PRIVATE LIMITED,Active
U51311DL1997PTC084317,ZEEBA OVERSEAS PRIVATE LIMITED,Active
U51109DL1996PTC082957,ECM SERVICES PRIVATE LIMITED,Active
U74899DL1998PLC078731,PURIAS FINLEASE INDIA LIMITED,Active
U65921DL1996PTC079862,VIDEO CLINIC PRIVATE LIMITED,Active
U74120DL1996PTC079974,D2C PROJECTS PRIVATE LIMITED,Active
U74899DL1995PTC074750,KHANNA AGENCIES PRIVATE LIMITED,Active
U74899DL1995PTC067571,LEADING SERVICES PRIVATE LIMITED,Active
U74899DL1995PTC070317,SHREE CHAMUNDI GAS AND CHEMICALS PRIVATE LIMITED,Active
U45201DL1997PTC087195,BHRIGHU PROPERTIES PRIVATE LIMITED,Active
U45201DL1997PTC085234,INTER PROJECTS PRIVATE LIMITED,Active
U74899DL1997PLC088218,PUNJ STAR PROPERTIES LIMITED,Active
U64202DL1999PTC098105,BRILLIANT INFOCOM PRIVATE LIMITED,Active
U72900DL2000PTC105188,VR VIRTUAL.COM PRIVATE LIMITED.,Active
U95000DL2000PTC107120,AYE-ONE MANAGEMENT ( S&C) PRIVATE LIMITED,Active
U74950DL1985PTC102276,HAMZA FILTERS PRIVATE LIMITED,Active
U51393DL1998PTC096376,WOOD ART INDIA PRIVATE LIMITED.,Active
U67120DL1999PTC100688,BEZEL SECURITIES PRIVATE LIMITED,Active
U45201DL2001PTC110732,SARCHANA CONSTRUCTIONS PRIVATE LIMITED,Active
U74899DL2001PTC109539,SHWETA FASHIONS PRIVATE LIMITED,Active
U74899DL2001PTC109271,CITI DENTAL CARE PRIVATE LIMITED,Active
U63011DL2001PTC113531,CHARU LOGISTICS PRIVATE LIMITED,Active
U74140DL2001PTC111337,FIRST FULL SERVICES PRIVATE LIMITED,Active
U21012DL2003PTC120725,COLD FOIL INDIA PRIVATE LIMITED,Active
U72200DL1999PTC101742,SOLUTION HUT (INDIA) PRIVATE LIMITED.,Active
U31909DL2004PTC123904,TEX WATER PUMPS PRIVATE LIMITED,Active
U67120DL2003PTC120184,B H SECURITIES PRIVATE LIMITED,Active
U80302DL2004PTC126057,ORION EDUCARE PRIVATE LIMITED,Active
U21029DL1997PTC091212,M S DURO PACK PRIVATE LIMITED,Active
U74210DL1997PTC090997,IFOCUS COMTECH PRIVATE LIMITED,Active
U51909DL1997PTC089568,PUNEET OVERSEAS PRIVATE LIMITED,Active
U51909DL1997PTC089153,PLEASANCE TECHNOLOGIES PRIVATE LIMITED,Active
U63040DL1997PTC090771,PATHFINDER TRAVELS PRIVATE LIMITED,Active
U74999DL2005PTC138964,COMET CONVERSION SERVICES (INDIA) PRIVATE LIMITED,Active
U51909DL2004PTC126690,KIRI EXPORTS PRIVATE LIMITED,Active
U45201DL2003PTC121895,MADHYAM HOUSING SOLUTIONS PRIVATE LIMITED,Active
U45201DL2004PTC131476,DIAMOND CITY BUILDTEC PRIVATE LIMITED,Active
U51909DL2002PTC116538,WEINER IMPEX PRIVATE LIMITED,Active
U70100DL2003PTC118888,SARAL INFRACHEM PRIVATE LIMITED,Active
U74140DL2003PTC118864,SPENTA PROCESS MANAGEMENT SERVICES PRIVATE LIMITED,Active
U65910GJ1994PLC023545,PAR LEASE AND FINANCE LIMITED,Active
U52392DL2002PTC117427,CHELYABINSK ENTERPRISES INDIA PRIVATE LIMITED,Active
U51101DL2005PTC140423,UNITED VILLAGES NETWORKS PRIVATE LIMITED,Active
U72200DL2005PTC137115,ETERNITY SOFTWARE SOLUTIONS PRIVATE LIMITED,Active
U27310DL2005PTC132493,MADHAV ISPAT PRIVATE LIMITED,Active
U27106DL2005PTC137619,SSS FABRICATORS PRIVATE LIMITED,Active
U67120MH1980PTC023132,KAMOD HOLDINGS COMPANY PRIVATE LIMITED,Active
U65990MH1980PTC023135,HINDOL INVESTMENTS COMPANY (A PVT CO),Active
U67120MH1980ULT023185,MAGH INVESTMENTS COMPANY PRIVATE LIMITED,Active
U70100MH1996PTC103761,MYLUCK HOUSING PRIVATE LIMITED,Active
U51211AS1997PTC004991,MAHALCHAND MOTILAL KOTHARI PRIVATE LIMITED,Active
U28992PN1992PTC065202,EVEREST (SILVASSA) BOX INDUSTRIES PRIVATE LIMITED,Active
U50500GJ2022PLC135830,ADANI AVIATION FUELS LIMITED,Active
U55101MH2001PTC131462,NIGHT KINGDOM HOTELS AND AMUSEMENT PRIVATE LIMITED,Active
U00113TZ1995PTC006753,VEERA ORCHARDS PRIVATE LIMITED,Active
U72200TG1999PTC032119,TGV INFOSYSTEMS PRIVATE LIMITED,Active
U21023DL2005PTC140981,OM SAI PACKAGINGS PRIVATE LIMITED,Active
U17111TZ1995PTC006457,JAI ANJANEYA INDUSTRIES PRIVATE LIMITED,Active
U17111TZ1987PLC001960,SREE SANKUCHAKKARA MILLS LTD,Active
U74950GA2001PTC002962,SHUNYATA ARTS PRIVATE LIMITED,Active
U65921TZ1971PTC000638,NILGIRI SHELTERS PRIVATE LIMITED,Active
U45203TN1994PTC045754,TIRUPUR CONTAINER TERMINALS PRIVATE LIMITED,Active
U17111TZ2005PTC011936,ERODE JAKANMADA SPINNING PRIVATE LIMITED,Active
U45201GJ2006PTC049672,ESSARE ENTERPRISE PRIVATE LIMITED,Active
U17115TZ1989PTC002449,BANNARI AMMAN TEXTILES PRIVATE LIMITED,Active
U72200UP2000PTC025722,E-VOLVE SOLUTIONS PRIVATE LIMITED,Active
U70109MH2007PTC166825,HERA REALCON PRIVATE LIMITED,Active
U70101TZ2007PTC013377,R V AGRO HOLDINGS INDIA PRIVATE LIMITED,Active
U72200KL2007PTC020278,TRIV SOFTWARE PRIVATE LIMITED,Active
U45400WB2007PTC117192,YOGDEEP INFRASTRUCTURE DEVELOPERS PRIVATE LIMITED,Active
U27109RJ2007PTC023810,GOELS JAIN ROLLING MILLS PRIVATE LIMITED.,Active
U72300TG2007PTC053658,KRCS TECHNOLOGIES PRIVATE LIMITED,Active
U72900KA2007PTC043547,OUTDU HOLDINGS PRIVATE LIMITED,Active
U24232MP2007PTC019521,BLACKSHIELD HEALTHCARE PRIVATE LIMITED,Active
U27101OR2007PTC009342,ANAND FERRO INDUSTRIES PRIVATE LIMITED,Active
U72900KL2008PTC021627,IPIX BPO PRIVATE LIMITED,Active
U45200TN2007PTC065177,SADIE DEVELOPERS PRIVATE LIMITED,Active
U70102DL2008PTC173478,D H ESTATES (INDIA) PRIVATE LIMITED,Active
U74120UP2008PTC034604,ATULYAM RETAILS NETWORK PRIVATE LIMITED.,Active
U51909DL2022PTC405237,LPRUNES PRIVATE LIMITED,Active
U74300AP2007PTC055755,KRISALS ADVERTISING PRIVATE LIMITED,Active
U85500TZ2008PTC014338,BHARATHIYA SCHOOL OF MANAGEMENT PRIVATE LIMITED,Active
U72200CH2008PTC031072,INTEQ INFOCOM SOLUTIONS PRIVATE LIMITED,Active
U27209CT2007PLC020492,NECO STRIPS LIMITED,Active
U17120GJ2007PLC052276,MAASHAKTI INDUSTRIES LIMITED,Active
U51909MH2008PTC180524,GLOBEX ENERGIA PRIVATE LIMITED,Active
U15500GJ2008PTC052781,ZERO BAC BEVERAGES (INDIA) PRIVATE LIMITED,Active
U70101TN2008PTC066179,KANNAN REAL ESTATE PROMOTERS PRIVATE LIMITED,Active
U51909DL2008PTC266996,VERSATILE VINIMAY PRIVATE LIMITED,Active
U18100GJ2021PTC121405,KANMAK GLOBAL PRIVATE LIMITED,Active
U51909WB2008PTC124632,DYNAMO BARTER PRIVATE LIMITED,Active
U74900GJ2008PTC053600,DEVDEEP PLYLAM PRIVATE LIMITED,Active
U70109DL2008PTC179008,HANSMUKHI PROJECT SERVICES PRIVATE LIMITED,Active
U51900TN2008PTC068176,ROJA ENERGY AND TRADING PRIVATE LIMITED,Active
U74140DL2008PTC180876,SHEFFIELD SECURITY SOLUTIONS PRIVATE LIMITED,Active
U45200DL2008PTC179838,AMBIENCE REALTECH INDIA PRIVATE LIMITED,Active
U74140DL2008PTC179623,PURE CONFERENCE SOLUTIONS PRIVATE LIMITED,Active
U74210WB2008PTC127042,KBG ENGINEERING PRIVATE LIMITED,Active
U37200KL2008PTC022616,EDAYAR EFFLUENT TREATMENT PLANT PRIVATE LIMITED,Active
U23300JH2004PTC011030,LAXMI FUELS AND SERVICES PRIVATE LIMITED,Active
U74140PN2006PTC129127,YOGESHWARI CONSULTANCY & MANAGEMENT PRIVATE LIMITED,Active
U45400MH2008PTC182509,SARVESHWAR PROPERTIES PRIVATE LIMITED,Active
U70109DL2008PTC179840,COLUMBUS PROPERTIES PRIVATE LIMITED.,Active
U72300HR2008PTC037874,STOP N SOLVE MULTIMEDIA AND SOFTWARES PRIVATE LIMITED,Active
U60231KA1970PTC013856,REKHI ROADLINES PRIVATE LIMITED,Active
U45400DL2008PTC181523,MAHINDER SHARMA DEVELOPERS PRIVATE LIMITED,Active
U45201KA2006PTC039575,HALCYON CONDOMINIUMS PRIVATE LIMITED,Active
U45101DL2006PTC148852,TARUN AGGARWAL BUILDCON PRIVATE LIMITED,Active
U45201RJ2006PTC022318,J R LAND DEVELOPERS PRIVATE LIMITED,Active
U14108DL2008PTC180987,SHREE BANKEY BIHARI MINERALS PRIVATE LIMITED,Active
U72900KA2001PTC028701,SYNECTIC TELECOM EXPORTS PRIVATE LIMITED,Active
U72200KA2008PTC047793,AXIO PROFESSIONAL SOLUTIONS PRIVATE LIMITED,Active
U41000DL2008PTC182396,FLAGMO EA TECHNOLOGIES PRIVATE LIMITED,Active
U72200RJ2008PTC027008,KAPPA E-VENTURES PRIVATE LIMITED,Active
U64204AP2020OPC114337,WEBSCOOP MEDIA (OPC) PRIVATE LIMITED,Active
U72200MP2008PTC021030,DIGICLAY INFOTECH PRIVATE LIMITED,Active
