CIN,Company Name,Status
U65990MH2020PTC352840,KAVI TRAVELS AND FOREX PRIVATE LIMITED,Active
U50500UP2019PTC112190,ZEN AUTOMOTIVE PRIVATE LIMITED,Active
U80901KA2019PTC120418,ABVITAC INTERNATIONAL PRIVATE LIMITED,Active
U74999TG2018PTC121762,OVIYA INTERIORS SOLUTIONS PRIVATE LIMITED,Active
U24299MH2019PTC320001,CAPILLARY PARENTERALS (I) PRIVATE LIMITED,Active
U52609DL2019PTC344976,RIZHORIZON PRIVATE LIMITED,Active
U72900OR2019PTC030386,CYBERFOLKS TECHNOLOGIES PRIVATE LIMITED,Active
U70109TN2019PTC127609,PARTHO PROPERTIES PRIVATE LIMITED,Active
U22219DL2019PLC346511,PKJ PUBLISHERS LIMITED,Active
U51909TG1990PTC011088,DREAM DESIGN EXPORTS PVT. LTD.,Active
U24230TG1995PLC020644,VERA PHARMA LIMITED,Active
U74999KA2022OPC165755,VIKSHITH GANESH (OPC) PRIVATE LIMITED,Active
U18209UP2022PTC170298,SUMIR FAB CREATIONS PRIVATE LIMITED,Active
U27100GJ1973PTC002434,INVENTA STEELS PVT LTD,Active
U00314JH1994PTC006120,S.G. ENTERPRISES PRIVATE LIMITED,Active
U45201GJ1993PTC018862,CHAMPANER CONSTRUCTION PVT LTD,Active
U24231GJ1993PTC020484,VIJAY DEEP DYE-CHEM PVT LTD,Active
U36912GJ1989PTC013127,CGI OPHTHALMIC PRIVATE LIMITED,Active
U14108KL1994PLC007975,MUTHOOT APT CERAMICS LTD,Active
U67120KA2003PTC031589,KRISH AND RAM FOREX PRIVATE LIMITED,Active
U67120KA2004PTC034567,MOLARK ENTERPRISES PRIVATE LIMITED,Active
U24223MH1951PLC008367,RAINBOW INK AND VARNISH MANUFACTURING COMPANY LIMITED,Active
U45400MH2022PTC390488,KANESA HOMES PRIVATE LIMITED,Active
U65990MH1981PTC025532,ENTERMONDE INVESTMENTS PVT LTD,Active
U72900HR2022OPC106675,YAHR CONSULTANCY (OPC) PRIVATE LIMITED,Active
U45201MH2022PTC390712,KANESA LIFESPACES PRIVATE LIMITED,Active
U74999DL2022FTC404817,VISAWORKS GLOBAL (INDIA) PRIVATE LIMITED,Active
U67120MH1995PTC091896,RAISONI SECURITIES PRIVATE LIMITED,Active
U92312GJ1995PTC057690,MAGIC BOX PRODUCTIONS PRIVATE LIMITED.,Active
U63040MH2000PTC124358,MUTUAL TRAVELS ( INDIA) PRIVATE LIMITED,Active
U51900MH2000PTC128023,YMH ENTERPRISES PRIVATE LIMITED,Active
U63090MH2000PTC130097,SEATRANS LOGISTICS (INDIA) PRIVATE LIMITED,Active
U17299MH1997PTC110060,ANDAZ TEXTILES PRIVATE LIMITED,Active
U85110TN1993PTC025885,MADRAS ANDROLOGY RESEARCH CENTRE PRIVATE LIMITED,Active
U45201TN2002PTC050041,APEX FOUNDATIONS PRIVATE LIMITED,Active
U72300TN1998PTC040048,APEX TRANSCRIPTERS PRIVATE LIMITED,Active
U25209PN1992PTC020525,NEW CHEM PLASTICS (I) PRIVATE LIMITED,Active
U74899DL1990PTC041376,DEEANJALI STAMPINGS PRIVATE LIMITED,Active
U74899DL1992PTC051146,RAJIVA EXPORTS PRIVATE LIMITED,Active
U74899DL1994PTC062439,AKASH GANGA PORTFOLIOS PRIVATE LIMITED,Active
U19201DL1993PTC053256,CAPITAL POLYMERS INDUSTRIES PRIVATE LIMITED,Active
U74899DL1995PTC070192,STRING DEVELOPERS PRIVATE LIMITED,Active
U74899DL1995PTC070802,CHINAR METALS PRIVATE LIMITED,Active
U25111DL1998PTC068198,CHOUDHARY TYRES PRIVATE LIMITED,Active
U65992DL2001PTC112610,SAMBHAV CHIT FUND PRIVATE LIMITED,Active
U49230DL2004PTC124850,D K INVESTIGATORS PRIVATE LIMITED,Active
U72200PN2000PTC014524,E VYAPAR INFO SOLUTIONS PRIVATE LIMITED,Active
U36101MP2007PTC019544,EURO DOORS AND DOORS PRIVATE LIMITED,Active
U85110MH2008PTC178690,ASHIRWAD MULTISPECIALITY HOSPITAL AND RESEARCH CENTRE PRIVATE LIMITED,Active
U18101DL2008PTC177606,DURGA CREATIONS PRIVATE LIMITED,Active
U45400TN2008PTC068903,SENSA HARMYA CONSTRUCTIONS PRIVATE LIMITED,Active
U85195KA2003PTC031964,CRYO STEMCELL PRIVATE LIMITED,Active
U74999TG2008PTC059636,ITECHMETHODS SOLUTIONS INDIA PRIVATE LIMITED,Active
U32201DL2009PTC189591,COLORS TELETECH PRIVATE LIMITED,Active
U45201DL2006PTC146135,SATYA DEEP BUILDERS PRIVATE LIMITED,Active
U45202MH2010PTC201908,MADHURAM CONSTRUCTIONS AND LAND DEALINGS COMPANY PRIVATE LIMITED,Active
U74140WB2010PTC141565,GOODWARD FINANCIAL ADVISORY PRIVATE LIMITED,Active
U63040KL2010PTC026542,XARA ACTIVE VACATIONS PRIVATE LIMITED,Active
U72200KL2011PTC027475,DHILOGICS SOLUTIONS INDIA PRIVATE LIMITED,Active
U72300MH2011PTC211838,ASYMMETRIX SOLUTIONS PRIVATE LIMITED,Active
U51909DL2009PTC270668,LAKEVIEW TRADELINKS PRIVATE LIMITED,Active
U70109WB2009PTC140409,DHAIRYA PROJECTS PRIVATE LIMITED,Active
U40106RJ2011PTC035492,SHINING SUN POWER (KARNATAKA) PRIVATE LIMITED,Active
U85100MH2011PTC218035,LES FLEURS ANGELIQUE PRIVATE LIMITED,Active
U92132TG2011PTC074339,SIRANJALI MEDIA PRIVATE LIMITED,Active
U51909WB2009PTC134821,SAMMAN VANIJYA PRIVATE LIMITED,Active
U72400TN2009PTC072773,MASYS TECHNOSOFT PRIVATE LIMITED,Active
U70109TN2012PTC085477,DIMENSIONS PROPERTIES PRIVATE LIMITED,Active
U74120DL2012PTC235394,LUMUS MEDIA PRIVATE LIMITED,Active
U74900JK2011PTC003397,KPO PUBLICATION SERVICES PRIVATE LIMITED,Active
U72200MP2012PTC027749,RECHARGE DIGITAL CONTENT PRIVATE LIMITED,Active
U01111GJ2012PTC069344,LEELA SEEDS PRIVATE LIMITED,Active
U74999DL2014PTC271592,AIR & TECHNOLOGY SOLUTIONS PRIVATE LIMITED,Active
U74900WB2014PTC201846,DREAMVIEW DEVELOPERS PRIVATE LIMITED,Active
U72300GJ2013PTC077029,UNIQUE E-COMMERCE CENTRE PRIVATE LIMITED,Active
U70101MP2013PTC030792,KESAR INFRAPROJECTS PRIVATE LIMITED,Active
U72200GJ2013PTC075263,PVD CONSULTING PRIVATE LIMITED,Active
U72200TZ2013PTC019561,OFIRSOFT INDIA PRIVATE LIMITED,Active
U92100MH2005PTC153658,J S FILMS PRIVATE LIMITED,Active
U52100GJ2014PTC081470,PREMDEEP AGRO GENETICS PRIVATE LIMITED,Active
U72900GJ2014PTC081232,EMPOWER TECHNOVISION PRIVATE LIMITED,Active
U24233TN2014PTC097508,ANDERSONS CHEMICALS PRIVATE LIMITED,Active
U51491MH2001PTC132377,SPAN FIBRE (INDIA) PRIVATE LIMITED,Active
U01403TN2007PTC065156,SUMO AGRICULTURAL OPERATIONS PRIVATE LIMITED,Active
U17291WB2014PTC200733,F.B. CREATIONS PRIVATE LIMITED,Active
U92141MH2006PTC163634,R AND J ENTERTAINMENT PRIVATE LIMITED,Active
U74140KA2006PTC040682,HEURION CONSULTING PRIVATE LIMITED,Active
U72200KA2015PTC084522,NEXVERX SYSTEMS INDIA PRIVATE LIMITED,Active
U45400AP2016PTC098038,NINE INFRA ENGINEERS INDIA PRIVATE LIMITED,Active
U74900KA2015PTC084857,FLIXY GAMES PRIVATE LIMITED,Active
U74900KA2016PTC085411,ELEMENTORA DIGITAL PRIVATE LIMITED,Active
U45200MH2015PTC267924,SCHEMAATICS DEVELOPERS PRIVATE LIMITED,Active
U74999DL2015PTC285848,MBX BUSINESS CONSULTING PRIVATE LIMITED,Active
U24100GJ2013PTC077144,SHYAM BUILDCHEM PRIVATE LIMITED,Active
U74999MH2016PTC288608,AYON HOME SERVICES PRIVATE LIMITED,Active
U01132UP2008PTC096920,SHAKAMBHARI TEA PRIVATE LIMITED,Active
U74999MP2016PTC041923,LALITA INDUSTRIAL SECURITY SERVICE PRIVATE LIMITED,Active
U74110MH1985PTC036558,PINK PINEAPPLE DESIGNERS PRIVATE LIMITED,Active
U72200DL2015PTC281062,FREIGHT MANTRA PRIVATE LIMITED,Active
U74900DL2016PTC291735,SPDS OVERSEAS PRIVATE LIMITED,Active
U45201JH2016PTC003592,NAMHAR INFRA PRIVATE LIMITED,Active
U74900MH2016PTC272994,YOSHI DIAMOND JEWELLERY PRIVATE LIMITED,Active
U72900PN2015PTC157603,CONCEDGE COMMUNICATIONS PRIVATE LIMITED,Active
U52609TG2018PTC121575,RUDHMA TRADING PRIVATE LIMITED,Active
U74999MH2016PTC282148,GVD LATEX PRIVATE LIMITED,Active
U74999TN2016PTC111660,ISCISTECH TRADINGS AND DISTRIBUTIONS PRIVATE LIMITED,Active
U72200DL2016PTC301903,LEARNING DROME PRIVATE LIMITED,Active
U74999KA2017PTC099460,D&K GENERAL OVERSEAS CONSULTING PRIVATE LIMITED,Active
U72200TG2016PTC113476,CHEAP SMS DOT COM BULK MESSAGING SERVICES PRIVATE LIMITED,Active
U55101DL2016PTC298629,VITARKA HOSPITALITY PRIVATE LIMITED,Active
U93090DL2017PTC319761,WORKSHIP GLOBAL PRIVATE LIMITED,Active
U63030GJ2017PTC096893,MDSS TRAVELS PRIVATE LIMITED,Active
U70103DL2016PTC306393,BROADFIELD REALTORS PRIVATE LIMITED,Active
U74999AP2016PTC104211,POMMALA SP TECHNOLOGIES PRIVATE LIMITED,Active
U01114KL2016PTC046911,THRISSUR ORGANIC FARM PRIVATE LIMITED,Active
U74999DL2017PTC315434,ASSURED IMMIGRATION CONSULTANTS PRIVATE LIMITED,Active
U74999PN2016PTC166261,SCHNEIDER ELEVATOR PRIVATE LIMITED,Active
U29308PN2017FTC169695,ANTEC WIND INDIA PRIVATE LIMITED,Active
U37200MH2021PTC358870,AMANECER WASTE MANAGEMENT PRIVATE LIMITED,Active
U01132RJ2008PTC058771,KUMAR VANIJYA PRIVATE LIMITED,Active
U74999DL2017PTC322850,DILIGENT RENTAL SERVICES PRIVATE LIMITED,Active
U15122BR2013PTC035796,KUMBHAH TEA PRIVATE LIMITED,Active
U74999PY2017PTC008169,PERUVIAN ENERGY PRIVATE LIMITED,Active
U35923MH2017PTC300843,METATRON TECHNOLOGIES INDIA PRIVATE LIMITED,Active
U70109DL2017PTC317679,KG3 INFRASOLUTIONS PRIVATE LIMITED,Active
U55101MH2017PTC300330,SOHAM HOSPITALITY PRIVATE LIMITED,Active
U74999PN2017OPC170735,CODENACK (OPC) PRIVATE LIMITED,Active
U85200RJ2017PTC059095,CARADORA HEALTH SOLUTIONS PRIVATE LIMITED,Active
U27320MH2017PLC296456,ARROWPOINT TRADE LIMITED,Active
U74994TG2018PTC121641,AQUILEGIA TRADING CONSULTANTS PRIVATE LIMITED,Active
U74999TN2018PTC120824,CIRCLES UTILITY MANAGEMENT PRIVATE LIMITED,Active
U74999TG2018PTC121662,GAILLARDIA INDENT TRADERS PRIVATE LIMITED,Active
U74994DL2018OPC329360,GURUJI ASTROLOGY AND VEDIC MANTRAS PRAYERS (OPC) PRIVATE LIMITED,Active
U85300UP2018PTC101357,INDU INSTITUTE OF MEDICAL SCIENCE PRIVATE LIMITED,Active
U72200KA2018PTC113434,BOUNTIFUL SOFTWARE INDIA PRIVATE LIMITED,Active
U74999KL2018PTC053178,NUFINANZ PRIVATE LIMITED,Active
U05000AP2018PTC109430,SRI VIJAYA DURGA SEAFOOD WORKS PRIVATE LIMITED,Active
U74999HR2018PTC075904,SOLCREST ENERGY PRIVATE LIMITED,Active
U34102TZ2020PTC034091,BGB INDUSTRIES PRIVATE LIMITED,Active
U74999WB2018PTC225700,SWEETLAKE ENTERTAINMENT PRIVATE LIMITED,Active
U74999DL2018PTC332150,WINDSON DYNAMICS PRIVATE LIMITED,Active
U74999MH2019PTC322901,SPMR PHARMA PRIVATE LIMITED,Active
U74999DL2018PTC341913,PIPORE BEVERAGES PRIVATE LIMITED,Active
U67100GJ2018PTC105185,VNK FINANCE PRIVATE LIMITED,Active
U52390UP2019PTC117879,DAVHOO ONLINE FASHION PRIVATE LIMITED,Active
U65992KL2018PTC055605,VASUREVATH CHITS PRIVATE LIMITED,Active
U72501WB2019PTC231839,TWINBEEZ NETWORK PRIVATE LIMITED,Active
U74999RJ2018PTC062892,ARTHAKAUT SERVICES PRIVATE LIMITED,Active
U80904KA2018PTC117738,ALIANCE PRESTIGE INTERNATIONAL PRIVATE LIMITED,Active
U74999PY2018PTC008342,THIRUMALAI HI TECH PLASTIC PRIVATE LIMITED,Active
U45201DL2019PTC350898,TECHCORAL SOLUTIONS INDIA PRIVATE LIMITED,Active
U50200MH2019PTC326147,DEE CAR CARE STUDIO PRIVATE LIMITED,Active
U72300UP2019OPC118334,PIHU SERVICES (OPC) PRIVATE LIMITED,Active
U70109KA2019PTC125451,PROPNEXT BUSINESS SOLUTIONS PRIVATE LIMITED,Active
U74999KL2019PTC058449,MCLIK PRIVATE LIMITED,Active
U45309BR2021PLC053128,RITUAL CONSTRUCTIONS AND INFRA LIMITED,Active
U72900PN2019PTC187662,HHX CONSULTING PRIVATE LIMITED,Active
U65929RJ2019PTC066680,SHRI GANESHAM FOREX PRIVATE LIMITED,Active
U72900GJ2019PTC109673,PM-CUBE SOLUTIONS PRIVATE LIMITED,Active
U31909UP2019PTC120924,ANKUG SMART TECHNOLOGIES PRIVATE LIMITED,Active
U85100HR2019PTC084016,KAPITAAS BUSINESS STRATEGY AND ALLIANCES PRIVATE LIMITED,Active
U25190KA2020PTC133619,SMR GLOBAL LATEX PRIVATE LIMITED,Active
U51909GJ2020PTC112479,GREENSPARK SUNLIGHT PRIVATE LIMITED,Active
U17299MH2020PTC337890,A&G TEX INDUSTRY PRIVATE LIMITED,Active
U51909KA2020PTC133146,UDREKA EXPORTS PRIVATE LIMITED,Active
U55209MH2020PTC336967,SHEETAL HOSPITALITY PRIVATE LIMITED,Active
U67200MH2020PTC337343,MANGAL ROYAL FOREX PRIVATE LIMITED,Active
U72900PN2020PTC189794,OLOID TECH PRIVATE LIMITED,Active
U93090UR2020OPC010970,ENTHRIVER ECOM (OPC) PRIVATE LIMITED,Active
U41000TN2020PTC133611,GASMO ENVIRO SOLUTIONS PRIVATE LIMITED,Active
U51504MH2020PTC340092,SIMBASRL INDIA PRIVATE LIMITED,Active
U74999HR2020PTC085872,WINFULENTIALS PROFESSIONAL CONSULTANTS PRIVATE LIMITED,Active
U15200RJ2020OPC071246,MANMOHAN NATURAL DAIRY FARM (OPC) PRIVATE LIMITED,Active
U28999RJ2020PTC071128,ROYAL PRIME TUBES PRIVATE LIMITED,Active
U72900KL2020PTC063852,ACINONYX TECH LABS PRIVATE LIMITED,Active
U72502PN2020OPC193002,SHREE VAISHNAVI COMPUTERS (OPC) PRIVATE LIMITED,Active
U74999KL2020PTC062440,FUTURE ENCRYPT PRIVATE LIMITED,Active
U74994PN2020PTC192754,TOTAL REVOLUTION MARKETING PRIVATE LIMITED,Active
U50100GJ2020PTC115498,MOTTOR DEAL TECHNOLOGIES PRIVATE LIMITED,Active
U55209DL2020PTC366006,SPECTRE KITCHEN PRIVATE LIMITED,Active
U51909KA2020OPC136120,RPCONG (OPC) PRIVATE LIMITED,Active
U31900KL2020PTC063076,ALIVE IDEAS PRIVATE LIMITED,Active
U74110TG2020PTC141611,SWASTIK ONE PRIVATE LIMITED,Active
U33208UP2020PTC131102,ERKIN HEALTHCARE PRIVATE LIMITED,Active
U21000UR2020PTC011723,K.S. TISSUES PRIVATE LIMITED,Active
U15490AS2020PTC020663,WAHENGBAM BROTHERS AGRO INDUSTRIES PRIVATE LIMITED,Active
U22120PN2020PTC196743,BILLION DOLLAR INNOVATIONS PRIVATE LIMITED,Active
U64100MH2020PTC348269,ADVENUS MEDIA PRIVATE LIMITED,Active
U80902KL2020OPC066596,TRAINED2SHINE (OPC) PRIVATE LIMITED,Active
U45209JH2020PTC015746,PANINFRA DEVELOPERS PRIVATE LIMITED,Active
U74999DL2020PTC371618,ETHNIC DISCOVERY PRIVATE LIMITED,Active
U74994WB2020PTC240621,FACTORNEST TECHNOLOGIES PRIVATE LIMITED,Active
U74999UP2020PTC137062,SIXTH VISION MATRIX SOLUTIONS PRIVATE LIMITED,Active
U28999TZ2020PTC035109,ANIVARDHAN CONDUCTORS PRIVATE LIMITED,Active
U24299MH2020PTC351449,AMOURSUI VENTURES PRIVATE LIMITED,Active
U28999TZ2020PTC035021,RAJAPURUSH CONDUCTORS PRIVATE LIMITED,Active
U55209MH2020PTC345351,SV LODGING & BOARDING PRIVATE LIMITED,Active
U72900MH2021PTC360702,AYDEN LABS PRIVATE LIMITED,Active
U15520HR2021PTC095380,ETHER DISTILLERS PRIVATE LIMITED,Active
U74999RJ2021PTC074676,QCS FOOD CERT PRIVATE LIMITED,Active
U74999MH2021PTC359750,DESI ORIGINALS PRIVATE LIMITED,Active
U01409TG2021PTC151464,GUPTAS SALES AND MARKETING PRIVATE LIMITED,Active
U66000PN2022PTC210539,R BHARTI IMF PRIVATE LIMITED,Active
U67190DL2022PTC396021,FINCRITIC INDIA PRIVATE LIMITED,Active
U72900DL2022PTC398559,ZMK DIGITAL SOLUTIONS PRIVATE LIMITED,Active
U74999DL2022PTC397324,CHESSIAN CONSULTANTS PRIVATE LIMITED,Active
U18209TZ2022PTC039307,TIGEN APPAREL PRIVATE LIMITED,Active
U34100MH2022PTC382659,PRACHI EV MOBILITY PRIVATE LIMITED,Active
U74999HR2022PTC103652,WOM PROMO PRIVATE LIMITED,Active
U72900PN2022PTC211614,OCB SOLUTIONS INDIA PRIVATE LIMITED,Active
U80902HR2022PTC105969,PASSIONR DREAMWORKS PRIVATE LIMITED,Active
U52599HR2022PTC102715,NORTH WEST PACKAGING PRIVATE LIMITED,Active
U72200OR2022PTC039100,TRIBOHERMES TECHNOLOGIES PRIVATE LIMITED,Active
U72900UP2022PTC169339,FRITZ LEAGUE PRIVATE LIMITED,Active
U72900DL2022PTC396613,MINDMETHODS TECHNOLOGIES PRIVATE LIMITED,Active
U74999KA2022PTC159742,NUSIGMA GLOBAL CONSULTING PRIVATE LIMITED,Active
U64200TG2022PTC165903,DIGISTREAM BROADCASTING PRIVATE LIMITED,Active
U72900DL2022PTC397002,NEXTGEN GAMING SOLUTION PRIVATE LIMITED,Active
U63030WB2022PTC256782,AERODRIFTT LOGISTICS PRIVATE LIMITED,Active
U52100KA2022PTC161135,SANVI GLOBAL TRADERS PRIVATE LIMITED,Active
U14299KL2022PTC077760,AJL VENTURES PRIVATE LIMITED,Active
U51909TN2022OPC153572,BIGIIZ CONSUMER SERVICES (OPC) PRIVATE LIMITED,Active
U73100TZ2022OPC039349,BOBBY MARKET RESEARCH (OPC) PRIVATE LIMITED,Active
U46411MH2023PTC413866,JAYKOUN LIFESTYLES PRIVATE LIMITED,Active
U43309MH2023PTC413863,ANGELS BUILDINDIA DEVELOPERS PRIVATE LIMITED,Active
U40106GJ2022PTC137023,GRE RENEW ENERGY PRIVATE LIMITED,Active
U72900GA2022OPC015655,KYMBRE TAEKNI (OPC) PRIVATE LIMITED,Active
U92490KL2022OPC079346,L B PRODUCTIONS (OPC) PRIVATE LIMITED,Active
U24299MH2022PTC387678,UNIPLANT AGRITECH PRIVATE LIMITED,Active
U29308DL2022PTC400457,TORIGINS PRIVATE LIMITED,Active
U40300GJ2022PTC128815,SATYAJIT RENEWABLE ENERGY PRIVATE LIMITED,Active
U52500MH2022PTC374459,AYP TECHNOLOGIES PRIVATE LIMITED,Active
U55209TN2022PTC149355,ORGO SPACES PRIVATE LIMITED,Active
U01100TN2022PTC149196,SAIKRISHNA AGRI FARM DEVELOPERS PRIVATE LIMITED,Active
U72900MH2022PTC377109,PROTECHNOVATE PRIVATE LIMITED,Active
U74999HR2022PTC101186,MWS TECH SOLUTIONS PRIVATE LIMITED,Active
U15400AP2022PTC122186,TOWN KITCHENS INDIA PRIVATE LIMITED,Active
U36990MH2022PTC387016,FURNDEPOT PRIVATE LIMITED,Active
U33111MP2021PTC057651,VITAL WORKS PRIVATE LIMITED,Active
U85300AS2021PTC022226,U A VENTURES PRIVATE LIMITED,Active
U21021AP2021OPC120437,SESH 93 ACCESSORIES (OPC) PRIVATE LIMITED,Active
U17299TZ2021PTC037844,ESPEE CREATION PRIVATE LIMITED,Active
U65990TZ2021PTC037780,SASHTI INVESTMENTS PRIVATE LIMITED,Active
U24290KL2021PTC072692,BLUEMIN LIFECARE PRIVATE LIMITED,Active
U72900MH2021PTC372102,INTELBRIDGE SOLUTIONS INDIA PRIVATE LIMITED,Active
U01100MH2021PTC372955,ASIABROWN AGRI RESOURCES PRIVATE LIMITED,Active
U45309GJ2021PTC127627,SIMANDHAR BUILDSPACE PRIVATE LIMITED,Active
U72900DL2021OPC390726,SELL ZONE IMPEX (OPC) PRIVATE LIMITED,Active
U74999TN2021PTC147822,TAPAMS FINSERV PRIVATE LIMITED,Active
U74999UP2021PTC157557,SPOC RETAIL PRIVATE LIMITED,Active
U92410MH2021PTC374225,TRISHOOLIN PICTUREZ INDIA PRIVATE LIMITED,Active
U74300MH2008PTC186553,AUROUS COMMUNICATIONS AND EVENTS INDIA PRIVATE LIMITED,Active
U72900KA2021OPC152143,BLUELAN WORLD TECHNOLOGIES (OPC) PRIVATE LIMITED,Active
U51909HR2022PTC101624,SRPC TRADESERVE PRIVATE LIMITED,Active
U52393KA2022PTC158174,NAKASE EXPORTS PRIVATE LIMITED,Active
U74999OR2021PTC038305,SKYWALL FINSERVE PRIVATE LIMITED,Active
U40100HR2022FTC103338,RADIAN POWER INDIA PRIVATE LIMITED,Active
U29308GJ2021PTC127889,BHALIYA AND SINGH PRIVATE LIMITED,Active
U45201UP2021PTC153570,KRIDAY INFRAENGINEERS PRIVATE LIMITED,Active
U74140DL2021PTC384212,DRAWZZY INDIA PRIVATE LIMITED,Active
U28112TN2021PTC144929,BHARATH WIRON PRIVATE LIMITED,Active
U15100WB2019PTC234175,SC AQUA VITAE PRIVATE LIMITED,Active
U72900CH2021PTC043827,CLOUDSTREET WEB SOLUTIONS PRIVATE LIMITED,Active
U72900CT2021PTC011724,SARVANG SOLUTIONS PRIVATE LIMITED,Active
U15100DL2021PTC382627,JOYSTREET INDIA PRIVATE LIMITED,Active
U72900HR2021PTC097380,VIRTUAL UTILITY PRIVATE LIMITED,Active
U52209AP2021PTC119195,JASWIK MERIAN HUB PRIVATE LIMITED,Active
U74999DL2021PTC382351,PET SET PAW PRIVATE LIMITED,Active
U72900KA2021PTC150276,TARCON TECH PRIVATE LIMITED,Active
U51909GJ2021PTC123403,MYRIAD APOTHECARY PRIVATE LIMITED,Active
U72900KL2021PTC067848,BRIGHT TREE VENTURES PRIVATE LIMITED,Active
U21000HR2021OPC093317,DIVY PAPER PRODUCTS (OPC) PRIVATE LIMITED,Active
U72100KA2015PTC080194,WHITE TIGER VENTURES PRIVATE LIMITED,Active
U72900PN2021PTC198475,NOZOMI MERISTEM PRIVATE LIMITED,Active
U51909RJ2021PTC073366,CORONA SOLAR TECHNOLOGY PRIVATE LIMITED,Active
U55101KA2021PTC144016,GOODCHEF HOSPITALITY PRIVATE LIMITED,Active
U72900DL2021PTC376749,SANKAI TECHNOLOGIES PRIVATE LIMITED,Active
U52100TN2021PTC145976,TWICE TREASURED PRIVATE LIMITED,Active
U19200UP2021PTC146718,INDCOAT OUTSOLES PRIVATE LIMITED,Active
U40107UP2021PTC151768,DHARINI RENEWABLES PRIVATE LIMITED,Active
U45201MH2021PTC366527,AMANECER INFRASTRUCTURE PRIVATE LIMITED,Active
U24100TN2021PTC142588,THOZHUVAM PRIVATE LIMITED,Active
U72900BR2022PTC060546,SMARTSIGMA IT SERVICES PRIVATE LIMITED,Active
U74999DL2022PTC405663,KDSR SECURITY SERVICES PRIVATE LIMITED,Active
U36911RJ2022PTC084811,RATANMANI JEWELLERS PRIVATE LIMITED,Active
U74140UR2022PTC014897,ONCON SERVICES PRIVATE LIMITED,Active
U93190DL2023PTC411579,PERFECT-PITCH SPORTS MANAGEMENT PRIVATE LIMITED,Active
U46497UP2023PTC178004,BIONEXON LIFESCIENCES PRIVATE LIMITED,Active
U74109HR2023PTC110058,COZMIC ENGINEERING PRIVATE LIMITED,Active
U62099KA2023OPC171352,CLUB MILI DIGITAL (OPC) PRIVATE LIMITED,Active
U45201MH2022PTC395263,AVIK BUILDCON PRIVATE LIMITED,Active
U72900UR2023PTC015222,AVNI RESEARCH AND DEVELOPMENT PRIVATE LIMITED,Active
U58203RJ2023PTC087484,ARVOX SOLUTIONS PRIVATE LIMITED,Active
U62099CH2023PTC045088,SLIGHTED IT SOLUTIONS PRIVATE LIMITED,Active
U52292MH2023PTC403120,TITAN MARINE PRIVATE LIMITED,Active
U46512RJ2023PTC086907,VIAAR SOLUTIONS PRIVATE LIMITED,Active
U47714PN2023PTC220122,BOLDHIDE LEATHER EXPORT INDIA PRIVATE LIMITED,Active
U10799TN2023PTC159486,CITLIME INDUSTRIES AGRO PRIVATE LIMITED,Active
U41001MH2023PTC403070,RASHESHWAR SALES AND SERVICES PRIVATE LIMITED,Active
U62011WB2024PTC273618,CROWNPUSH TECH PRIVATE LIMITED,Active
U22209MH2024PTC430986,RAJNANDA ECOPET PRIVATE LIMITED,Active
U24103CT2024PTC016561,VAJRAKSHA ISPAT AND POWER PRIVATE LIMITED,Active
U62090TN2024PTC170244,EVINS INSURTECH PRIVATE LIMITED,Active
U55109MH2024PTC425052,BUZZIN BNB PRIVATE LIMITED,Active
U52292TN2024PTC170557,DAWNWAVE SHIP MANAGEMENT PRIVATE LIMITED,Active
U33200UP2024OPC203351,SHARADUPADHYAYSS INDUSTRIES (OPC) PRIVATE LIMITED,Active
U78100MH2024OPC421163,R.G.T.MANPOWER OUTSOURCING SERVICE (OPC) PRIVATE LIMITED,Active
U70200WB2024PTC269332,TSEA BUSINESS & SCIENCE CENTRE PRIVATE LIMITED,Active
U74102DL2024OPC430488,HOID VENTURE (OPC) PRIVATE LIMITED,Active
U52211HR2024PTC121444,PREXPARK PRIVATE LIMITED,Active
U55101GA2024PTC016536,MKBP HOSPITALITY PRIVATE LIMITED,Active
U82990DL2024PTC428540,ESURV ENSPIRE WORK PRIVATE LIMITED,Active
U62099HR2024PTC120363,ULT BUSINESS PRIVATE LIMITED,Active
U82910KA2024PTC186882,INTELLIWORKS PRIVATE LIMITED,Active
U43222UP2024PTC196342,SWEAFS ENTERPRISE PRIVATE LIMITED,Active
U63122UT2024PTC016745,INFRA QUAKE TECH PRIVATE LIMITED,Active
U10792GJ2024OPC148772,UDGAM COFFEE (OPC) PRIVATE LIMITED,Active
U82990MP2023PTC068661,RADIANTEZZA VERTEX PRIVATE LIMITED,Active
U11011CT2023PTC015548,SPHINX SPIRITS PRIVATE LIMITED,Active
U01611TZ2024PTC030308,SRSRITHAN ACRES PRIVATE LIMITED,Active
U47210KL2023PTC084977,MRG FOOD'S PRIVATE LIMITED,Active
U43299UP2023PTC194690,BHR CONSULTINGS PRIVATE LIMITED,Active
U47521DL2023OPC424185,SANSHA EXIM (OPC) PRIVATE LIMITED,Active
U93190UT2023PTC016503,CODE QUASAR SOLUTIONS PRIVATE LIMITED,Active
U27201GJ2024PTC147431,VOLCUP ENERGY PRIVATE LIMITED,Active
U10790KA2023PTC182179,NUTRIPADMA MUNCHIEZ PRIVATE LIMITED,Active
U82300DL2023PTC423609,TAILOR MADE DREAMS PRIVATE LIMITED,Active
U56101DL2023PTC421569,ANSHI LIFESTYLE PRIVATE LIMITED,Active
U85499DL2023OPC421333,DAAI CARE (OPC) PRIVATE LIMITED,Active
U61201MP2023PTC068345,RETRIVO SOLUTIONS & SERVICES PRIVATE LIMITED,Active
U49223KA2023OPC180493,MITPAS STUDIO (OPC) PRIVATE LIMITED,Active
U47721UP2023PTC190663,SHANTIBEENA EXPORTS PRIVATE LIMITED,Active
U47211HR2023PTC115148,KSKT AGRICART PRIVATE LIMITED,Active
U46497AP2023PTC112630,GOBINDO PHARMA PRIVATE LIMITED,Active
U74900TS2023PTC178809,AVIRBHAV EVALUA TECH ADVISORS PRIVATE LIMITED,Active
U47912HR2023PTC115760,URBAN HERBS HEALTHCARE PRIVATE LIMITED,Active
U62099DL2023PTC421192,ASIAMAX TECHNOLOGIES PRIVATE LIMITED,Active
U71100RJ2023OPC089391,MANNAT CONSULTANCY INFRA (OPC) PRIVATE LIMITED,Active
U86909KA2023PTC177445,SANGHAONE YOGA WELLNESS TECHNOLOGIES PRIVATE LIMITED,Active
U25992MH2023PTC409285,PLUXDY FOODS AND BEVERAGES PRIVATE LIMITED,Active
U74102MH2023OPC409730,BOTTEGA ECO PARIVAR (OPC) PRIVATE LIMITED,Active
U27900TZ2023PTC029392,EVOLTRO EV CHARGING SOLUTIONS PRIVATE LIMITED,Active
U66190KL2023PTC082673,AKSHAYA MONEY EXCHANGE PRIVATE LIMITED,Active
U85500JH2023PTC020985,INTELLITEACH CONSULTANCY PRIVATE LIMITED,Active
U10795RJ2023PTC089066,KHUSHIYAN INTERNATIONAL PRIVATE LIMITED,Active
U42909KA2023OPC176967,CORALBEADS MANAGEMENTCONSULTANTS (OPC) PRIVATE LIMITED,Active
U13946MH2023PTC407690,PURVA TAPES PRIVATE LIMITED,Active
U47722DL2023PTC418788,PINK GUAVA LIFESTYLE PRIVATE LIMITED,Active
U62013RJ2023PTC089401,LOOPELICIAN TECHNOLOGIES PRIVATE LIMITED,Active
U70200GJ2023PTC143183,PG CLICK UNIVERSAL PRIVATE LIMITED,Active
U62013DL2023PTC417075,GREY CHAIN AI PRIVATE LIMITED,Active
U45401UP2023OPC184043,SSDN AUTOSALES (OPC) PRIVATE LIMITED,Active
U52242TN2023PTC160937,STARFOS LOGISTICS PRIVATE LIMITED,Active
U64990KA2023PTC175295,DHARWAD SARAL CHITS PRIVATE LIMITED,Active
