CIN,Company Name,Status
U74900RJ2015OPC048048,TORNADO HYGIENE SOLUTIONS OPC PRIVATE LIMITED,Active
U70102UP2015PTC072448,OMKARA GURU CONSTRUCTION PRIVATE LIMITED,Active
U74910GJ2013PTC077888,KONNECT 4 MAN POWER SOLUTIONS PRIVATE LIMITED,Active
U74950UP2013PTC061415,PRIMEPACK PRODUCTS PRIVATE LIMITED,Active
U74900TG2012PTC078468,DARKMEN SECURITY FORCE PRIVATE LIMITED,Active
U51909WB2013PTC198433,SGNS TRADERS PRIVATE LIMITED,Active
U74999WB2012PTC173709,BENNEVIS BIOTEC PRIVATE LIMITED,Active
U41000BR2012PTC018178,SUBHADRA AQUA PRIVATE LIMITED,Active
U70109WB2012PTC171646,DHANDHAN DEVELOPERS PRIVATE LIMITED,Active
U74140DL2015PTC283841,SUPER SLEUTH SECURITY AGENCY & ALLIED SERVICES PRIVATE LIMITED,Active
U72300TG2015PTC099594,STYLISH ONLINE SERVICES PRIVATE LIMITED,Active
U67120GJ2012PTC068816,RAMANLAL GULABCHAND SHARE BROKERS PRIVATE LIMITED,Active
U17290RJ2015PTC047974,DURAFIT MATTRESS INDIA PRIVATE LIMITED,Active
U45200KA2012PTC062772,SOORU REALINFRATECH PRIVATE LIMITED,Active
U72900DL2015PTC282351,ADITYA ESOLUTIONS PRIVATE LIMITED,Active
U15122TG2012PTC078397,V M R N FOODS PRIVATE LIMITED,Active
U74900TN2015PTC101399,AMORFUS BEAUTY SERVICES PRIVATE LIMITED,Active
U74900TN2012PTC084047,SANN OFFSHORE PRIVATE LIMITED,Active
U72200KA2015PTC081894,DATALIFECYCLE KNOWLEDGE SERVICES PRIVATE LIMITED,Active
U18204MH2015PTC267245,MAINSTREAM FASHION INDUSTRIES PRIVATE LIMITED,Active
U74999PN2015PTC156913,ONE 1 ONE STARTUP SOLUTIONS PRIVATE LIMITED,Active
U15122WB2015PTC207153,KALYANI DISTILLERIES PRIVATE LIMITED,Active
U72300BR2015PTC025117,COSMOX TECH PRIVATE LIMITED,Active
U45206AP2015PTC097336,SAI VAISHNAVI INFRACON PRIVATE LIMITED,Active
U45209CH2012PTC033453,P.V.R. CAPITAL PRIVATE LIMITED,Active
U72300MH2015PTC270410,TNV TECH PRIVATE LIMITED,Active
U74140RJ2015PTC048496,NACTUS (INDIA) SERVICES PRIVATE LIMITED,Active
U70102UP2015PTC073427,AGARSONS DEVELOPERS PRIVATE LIMITED,Active
U51909DL2015PTC286467,DARAKHT LIFESTYLE PRIVATE LIMITED,Active
U51900TZ2013PTC020024,CATHAY MERCANTILE TRADING COMPANY PRIVATE LIMITED,Active
U74120TG2015PTC101616,SOMNIO TECHNOLOGIES PRIVATE LIMITED,Active
U74140HR2015PTC056876,CRAFTING FUTURES PRIVATE LIMITED,Active
U74900TG2013PTC090920,AVEDA LIFE SCIENCES PRIVATE LIMITED,Active
U72300MH2014PTC253200,GLOBORGS TECHNOLOGIES PRIVATE LIMITED,Active
U55101UP2013PTC060789,IMPERIALHERITAGE HOTELS PRIVATE LIMITED,Active
U63090DL2013PTC262250,A N EXIM SOLUTION PRIVATE LIMITED,Active
U70100DL2013PTC259434,MUDRA REALTY PRIVATE LIMITED,Active
U93090DL2016PTC308419,M. D. FILMS PRIVATE LIMITED,Active
U74999UP2016PTC088466,G+EET INFRA & SUPPLIERS PRIVATE LIMITED,Active
U50102MP2014PTC032182,SAMYAK WHEELS PRIVATE LIMITED,Active
U85100PN2015PTC155623,STEM EDULABS PRIVATE LIMITED,Active
U74999JK2016PTC009806,PYTHEUS TEK CONSULTANTS PRIVATE LIMITED,Active
U74110MH2010PTC206591,SUSHAMA TRADING PRIVATE LIMITED,Active
U74999DL2016PTC308950,MANSI HOLIDAYS PRIVATE LIMITED,Active
U74999MH2016PTC288959,EDUSKILLPRO PRIVATE LIMITED,Active
U74999MH2016PTC288338,INBLICK INNOVATION ADVISORY PRIVATE LIMITED,Active
U51909DL2013PTC254413,A.S.T EXIM PRIVATE LIMITED,Active
U45209KL2015PTC038004,DEVAMRUTHAM DEVELOPERS PRIVATE LIMITED,Active
U74120UP2015PTC070757,MASNEP ONLINE SERVICES PRIVATE LIMITED,Active
U52590TN2016PTC113397,DIVYAM COLLECTIONS PRIVATE LIMITED,Active
U72200KA2015OPC080964,NEHAN CONSULTING SERVICES PRIVATE LIMITED (OPC),Active
U74999MH2016PTC287700,LOL MEDIA PRIVATE LIMITED,Active
U45309KA2016PTC097833,PRAVARTANA CONSULTANTS PRIVATE LIMITED,Active
U74999HR2016PTC066373,HU SPACE DESIGN PRIVATE LIMITED,Active
U74999OR2016PTC026055,TZAR SOLUTIONS PRIVATE LIMITED,Active
U93000DL2015PTC278804,MANTHAN MANAGEMENT SOLUTIONS PRIVATE LIMITED,Active
U17290HR2015PTC055241,SANCTUM EXPORTS PRIVATE LIMITED,Active
U74999TG2016PTC113373,NIKKI AND SUMMIS IMPEX PRIVATE LIMITED,Active
U72300DL2015FTC279788,TUWHEELZ INDIA PRIVATE LIMITED,Active
U74990PN2016PTC158695,ISMART TRAINING AND CONSULTING PRIVATE LIMITED,Active
U72300TN2015PTC101067,PROCACE ONLINE SOLUTIONS PRIVATE LIMITED,Active
U01400HR2015PTC055338,H & S COMMODITIES PRIVATE LIMITED,Active
U70200DL2012PTC230002,SKMVR ESTATE PRIVATE LIMITED,Active
U51909WB2015PTC206026,SATYASATHI COMMERCIAL PRIVATE LIMITED,Active
U74999JH2015PTC002912,SHREE BALAJEE VENKATESH PHARMACY PRIVATE LIMITED,Active
U01122RJ2016PTC049567,ALWAR MAHILA SANGAM PRODUCER COMPANY LIMITED,Active
U80901WB2015PTC206045,SAMREEK SKILL ENTERPRISE PRIVATE LIMITED,Active
U74900HR2015PTC055184,KANKHU CHITS PRIVATE LIMITED,Active
U52100DL2015PTC282174,TIRTH ELECTRONICS SECURITY SOLUTIONS PRIVATE LIMITED,Active
U72300BR2015PTC024300,BIG HELPLINE PRIVATE LIMITED,Active
U40106TZ2016OPC022405,VALDE ENERGEIA (OPC) PRIVATE LIMITED,Active
U74900TN2016PTC104596,FPL NOKERO INDIA PRIVATE LIMITED,Active
U55101RJ2016PTC049552,FLAME TREE RESORTS PRIVATE LIMITED,Active
U74900TG2016PTC103574,RIVERB TECH SOLUTIONS PRIVATE LIMITED,Active
U40200TN2016PTC104627,TUTICORIN LNG TERMINAL PRIVATE LIMITED,Active
U72200TN2016PTC104548,AAKRO DEVELOPMENT PRIVATE LIMITED,Active
U80210KA2012PTC062094,CLOUD MENTOR EDUCATION SOLUTIONS PRIVATE LIMITED,Active
U74120UP2012PTC049184,MILLENIUM MANPOWER SERVICES PRIVATE LIMITED,Active
U72200KA2015PTC080660,WOTU TECHNOLOGIES PRIVATE LIMITED,Active
U72300WB2016PTC210122,COMPSENSE TECHNOLOGY PRIVATE LIMITED,Active
U45400TZ2016OPC022403,VALDE CONSTRUCTIONS (OPC) PRIVATE LIMITED,Active
U74900MH2016PTC273992,HK DIAGNOSTICS PRIVATE LIMITED,Active
U72200TZ2016PTC022443,B2K INFOTECH PRIVATE LIMITED,Active
U74999MH2018PTC304685,GYANANDA EDUTECH PRIVATE LIMITED,Active
U74900TG2015PTC099361,MITRAKSHA TECHNOLOGIES PRIVATE LIMITED,Active
U74990MH2012PTC226965,ANJANA MANSETA ADVISORY PRIVATE LIMITED,Active
U01100GJ2018PTC100709,AJAANI FISHERIES PRIVATE LIMITED,Active
U74140HR2015PTC054488,APEX EDUMENTORS PRIVATE LIMITED,Active
U31501KA2015PTC079221,OVERDRIVE ELECTRIC PRIVATE LIMITED,Active
U29253KA2012PTC062121,DASANUR AGRO & AUTOMOBILES PRIVATE LIMITED,Active
U52601RJ2016PTC056635,FATEHPURIA ELECTRONICS PRIVATE LIMITED,Active
U74999UP2016PTC088610,CIPHERBIZZ INFOTECH PRIVATE LIMITED,Active
U72900MH2016PTC289099,IRA LIFESTYLE VENTURES PRIVATE LIMITED,Active
U29253PN2016FTC158318,SYNERGY INDIA GREEN POWER SOLUTIONS PRIVATE LIMITED,Active
U74900KA2016PTC085996,ANARGHYAA ETECH SOLUTIONS PRIVATE LIMITED,Active
U93000DL2015PTC288141,PROBUM SERVICES PRIVATE LIMITED,Active
U40300DL2016PTC291241,DREAMATRIX ENGINEERING SOLUTIONS PRIVATE LIMITED,Active
U52390KL2016PTC039886,USMANIA DISTRIBUTORS PRIVATE LIMITED,Active
U74120MH2016PTC272085,IDS CONSULTING PRIVATE LIMITED,Active
U45400DL2015PTC288136,SGH INFRA PRIVATE LIMITED,Active
U74900DL2016PTC291505,SANTRA DIGITAL SERVICES PRIVATE LIMITED,Active
U24100TN2016PTC103784,TRIDAX PHARMA PRIVATE LIMITED,Active
U72900TN2016PTC104207,HSVJ TECH PRIVATE LIMITED,Active
U80904DL2017PTC313779,VACHI BOOK TUTOR PRIVATE LIMITED,Active
U72900KA2017FTC101146,DIGIVERV INDIA PRIVATE LIMITED,Active
U72900MH2017PTC291831,TRADEGYANI ANALYTICS PRIVATE LIMITED,Active
U24299UP2017OPC090566,NIFORD PHARMA (OPC) PRIVATE LIMITED,Active
U74999WB2017PTC219551,BRATYAJON PRODUCTIONS PRIVATE LIMITED,Active
U72900KL2016PTC040210,PREDMAC TECHNOLOGIES PRIVATE LIMITED,Active
U74999DL2016PTC303317,HARMAN SURGICALS PRIVATE LIMITED,Active
U33301DL2016PTC304480,LW SCIENCEKART INDIA PRIVATE LIMITED,Active
U45100TG2015PTC102249,TALENT RESOURCES GLOBAL PRIVATE LIMITED,Active
U72900MH2017PTC291846,ATHENE INNOVATIONS PRIVATE LIMITED,Active
U61200UP2016PTC085303,KONARKAGRO POLYTECH PRIVATE LIMITED,Active
U22219DL2019PTC359493,INTERNATIONAL STUDENTS IDENTITY CARD PRIVATE LIMITED,Active
U63030DL2017PTC313907,VALENTINE TRAVELS PRIVATE LIMITED,Active
U72900GJ2016OPC093233,TECH 3 SOLUTIONS (OPC) PRIVATE LIMITED,Active
U45403GJ2017PTC095789,JASRAJ SPACES PRIVATE LIMITED,Active
U17309MH2017PTC292109,SUPERBLUE INDUSTRIES PRIVATE LIMITED,Active
U74999TG2016PTC109894,DOC CONNECT PRIVATE LIMITED,Active
U93000HR2017PTC067670,MQD CONSULTECH PRIVATE LIMITED,Active
U74200DL2016PTC301394,ALTISSMA PROJECTS PRIVATE LIMITED,Active
U74999WB2016PTC215950,NEIL & BRAT ENGINEERS PRIVATE LIMITED,Active
U01100MH2016PTC281731,KV AGRO SOLUTIONS GLOBAL PRIVATE LIMITED,Active
U52520PY2016PTC008070,BABY BASICS PRIVATE LIMITED,Active
U72900KA2016PTC093530,INFICLOUD PRIVATE LIMITED,Active
U55209TN2016PTC110677,FARM TO TABLE FOOD LOGIC INDIA PRIVATE LIMITED,Active
U72900PN2016PTC164998,CLANINC TECH PRIVATE LIMITED,Active
U40108DL2016PTC300974,INDSHINE ENERGY PRIVATE LIMITED,Active
U85110TZ2015PTC021160,KOVAI URO NEPHRO AND CANCER CENTRE PRIVATE LIMITED,Active
U74999CH2016PTC041060,TECHNO ALICE PRIVATE LIMITED,Active
U28999RJ2016PTC055178,SHRITECH ENGINEERS PRIVATE LIMITED,Active
U63090AP2015PTC096289,NOAM LOGISTICS (INDIA) PRIVATE LIMITED,Active
U45400TN2013PTC090148,DIGNITY FOUNDATIONS PRIVATE LIMITED,Active
U25209WB2016PTC216950,HINDRAMA PET & CLOSURES PRIVATE LIMITED,Active
U72900TZ2016PTC027835,FULLTANK TECHNOLOGIES PRIVATE LIMITED,Active
U72294KA2016OPC094733,DESIGNSHORE TECHNOLOGIES PRIVATE LIMITED (OPC),Active
U74999WB2016PTC216868,ACQUABLISS MINERALS PRIVATE LIMITED,Active
U22219TZ2016PTC027843,RCJ GRAAPHICS PRIVATE LIMITED,Active
U51909KA2016PTC095314,WINNINGLOOP TECHNOLOGIES PRIVATE LIMITED,Active
U17299TG2016PTC110553,ABIT GARMENTS PRIVATE LIMITED,Active
U72900DL2016OPC302685,VIGRAHA (OPC) PRIVATE LIMITED.,Active
U51909KL2016PTC046262,URBAN SOIL COSMACEUTICALS PRIVATE LIMITED,Active
U72900MH2016PTC282763,SUPERAPP SOFTWARE SOLUTIONS PRIVATE LIMITED,Active
U51909PB2016PTC045467,ASP NATURE WAY NETWORK PRIVATE LIMITED,Active
U45200KA2013PTC069090,LOGGIA PROPERTIES & CONSTRUCTIONS PRIVATE LIMITED,Active
U72900RJ2015PTC047217,X 3D STUDIO PRIVATE LIMITED,Active
U74900PN2015PTC154488,TIL GLOBE PHARMA PRIVATE LIMITED,Active
U74900MH2013PTC245297,TASTEBOX HOSPITALITY PRIVATE LIMITED,Active
U55101DL2012PTC231095,ZAMBALA HOTEL & RESTAURANTS PRIVATE LIMITED,Active
U72900JH2012PTC000139,TECHNOLOGY MAZE PRIVATE LIMITED,Active
U74140KA2013PTC069618,SG ICONSULT MANAGEMENT AND OUTSOURCING PRIVATE LIMITED,Active
U72200DL2012PTC230294,AMICABLE INFORMATICS PRIVATE LIMITED,Active
U15400DL2012PTC232826,A ONE SNACKS PRIVATE LIMITED,Active
U29253DL2015PTC277811,SERVOTECH SOLAR APPLICATIONS PRIVATE LIMITED,Active
U40102TN2015FTC099071,SEI AGNI POWER PRIVATE LIMITED,Active
U72200KA2013PTC068777,AVISTA INFO SOLUTIONS PRIVATE LIMITED,Active
U74900TN2013PTC091732,MERCURE HEALTH CARE SERVICES PRIVATE LIMITED,Active
U45208TN2013PTC092617,SJ SPECTRUM PROPERTIES PRIVATE LIMITED,Active
U72900DL2017PTC310947,REVENTUS TECHNOLOGIES PRIVATE LIMITED,Active
U72200MH2016PTC288561,KYEPOT TECHNOLOGIES PRIVATE LIMITED,Active
U74999TN2017PTC114135,MADCREOS PRIVATE LIMITED,Active
U72900PN2017PTC167956,COZILLIO TECHNOLOGY PRIVATE LIMITED,Active
U74999PN2016PTC164174,NIRMITEE RETAILS PRIVATE LIMITED,Active
U74999DL2017PTC319707,ALLAXIS PROFESSIONAL SERVICES PRIVATE LIMITED,Active
U65999KL2016PLC045565,VALLATHOL NAGAR NIDHI LIMITED,Active
U74999UP2016PLC087165,SAMARTH NIDHI LIMITED,Active
U65990GJ2017PTC097994,ADITYA TRADING SOLUTIONS IFSC PRIVATE LIMITED,Active
U74999GJ2017PTC099990,PARIVAR LIFECARE PRIVATE LIMITED,Active
U72300PN2016PTC164129,HYPERBOLA TECHNOLOGIES PRIVATE LIMITED,Active
U70103KA2017PTC108018,ORANKO PROPERTIES PRIVATE LIMITED,Active
U74999DL2017PTC317211,OPETH WEB SERVICES PRIVATE LIMITED,Active
U74999KA2017PTC102512,MOUNTAINWARE EXCLUSIVE RETAIL PRIVATE LIMITED,Active
U74999UR2017PTC007776,PUREN INFRASTRUCTURE INDIA PRIVATE LIMITED,Active
U72909DL2017PTC316766,SCHOLASTICBEING SOLUTIONS PRIVATE LIMITED,Active
U70109WB2017PTC220244,SARAT PROPERTIES PRIVATE LIMITED,Active
U05150AP2017PTC105545,SAVITRI SHRIMPS PRIVATE LIMITED,Active
U72900GJ2016PTC093830,MEDISOFT SERVICES PRIVATE LIMITED,Active
U74999DL2017PTC316540,ZENUINE RETAIL SOLUTIONS PRIVATE LIMITED,Active
U72900TG2017PTC116122,ALACRITI APPLICATION SOLUTIONS PRIVATE LIMITED,Active
U52399TZ2016PTC027553,PULSE PLUS PRIVATE LIMITED,Active
U24299MP2016PTC041501,NUTRAKEM PHARMA PRIVATE LIMITED,Active
U74995KA2017PTC101808,ANOHA TECHNOLOGIES PRIVATE LIMITED,Active
U74999HP2017PTC006531,AMOUR BIOTECH PRIVATE LIMITED,Active
U27320KL2017PTC048729,MPG PRECIOUS METALS PRIVATE LIMITED,Active
U74994GJ2016PTC091745,WISHBOOK INFOSERVICES PRIVATE LIMITED,Active
U74999GJ2016PTC091743,ALTIS INSTITUTE OF MEDICAL SCIENCE PRIVATE LIMITED,Active
U74999UP2016PTC082959,SSV MEDIA PRIVATE LIMITED,Active
U72900KA2016PTC092764,ELOGICSQUARE ANALYTICS PRIVATE LIMITED,Active
U74999DL2016PTC306273,BASICXX RETAIL INDIA PRIVATE LIMITED,Active
U74999DL2016PTC299469,UMANG INDUSTRIES PRIVATE LIMITED,Active
U74999UP2016PTC086185,STARSURGE ADVISORY SERVICES PRIVATE LIMITED,Active
U70109AP2017PTC105432,KRIAN DEVELOPERS PRIVATE LIMITED,Active
U72900KA2016PTC093409,STEINBECK TECHNOLOGIES PRIVATE LIMITED,Active
U93090RJ2016PTC056044,WEDLOCK SERVICES PRIVATE LIMITED,Active
U51909DL2016PTC298996,ABHAY LUBRICANTS AND CHEMICALS PRIVATE LIMITED,Active
U45200WB2016PTC217710,ASHMIRA CONSTRUCTION PRIVATE LIMITED,Active
U69201DL2016PTC299651,PARTNERS FOR TRANSPARENCY  INDIA PRIVATE LIMITED,Active
U74999TZ2016PTC028020,FIXODO SOLUTIONS PRIVATE LIMITED,Active
U15549KA2018PTC114152,KAFKA GOURMET FOODS PRIVATE LIMITED,Active
U15490KA2017PTC101994,GAMTA PRODUCTS PRIVATE LIMITED,Active
U63090DL2017PTC315691,NARESH LOGISTICS PRIVATE LIMITED,Active
U51909KA2017PTC101850,LAST LEAF ORGANICS PRIVATE LIMITED,Active
U74999TN2016PTC112434,TOA'S KART INDIA PRIVATE LIMITED,Active
U72900AP2017PTC105420,KRIAN TECHNOLOGIES PRIVATE LIMITED,Active
U05005AP2017PTC105559,SAVITRI SEALINES PRIVATE LIMITED,Active
U52609UR2016PTC007267,VOWS AND WISHES PRIVATE LIMITED,Active
U01100MH2017PTC292767,AVANTIKA CROP SCIENCE PRIVATE LIMITED,Active
U64202RJ2016PTC055908,RAJASTHAN INTERNET SERVICES PRIVATE LIMITED,Active
U63030KL2018PTC052131,LUG INTERNATIONAL FORWARDING PRIVATE LIMITED,Active
U72900TZ2017PTC028632,PALLASITE WORKS PRIVATE LIMITED,Active
U72900MH2017PTC292535,ARCANDFUSION E-TECHNOLOGIES PRIVATE LIMITED,Active
U74999MH2017PTC292289,GERMINATI SPORTZ PRIVATE LIMITED,Active
U29309KA2017PTC103320,ADHIE GEARS AND HYDRAULICS PRIVATE LIMITED,Active
U74999MH2017PTC302439,FOGASS INFOTECH PRIVATE LIMITED,Active
U74999DL2017PTC326291,WINFINITY SOLUTIONS PRIVATE LIMITED,Active
U01100GJ2017PTC098573,RIDAK AGRO PRIVATE LIMITED,Active
U92490KA2017PTC108368,MASUVI PRODUCTIONS PRIVATE LIMITED,Active
U51909TG2017PTC117267,CROZES IMPEX PRIVATE LIMITED,Active
U25209UP2017PTC094949,IP PLASTOTECH PRIVATE LIMITED,Active
U15115MH2017PTC297891,NUTRITE HEALTHCARE PRIVATE LIMITED,Active
U72900KA2017PTC104611,SVIKRTI TECHNOLOGIES PRIVATE LIMITED,Active
U72501DL2017PTC322798,ASHWINI INFOCOM PRIVATE LIMITED,Active
U28998TN2017PLC117834,SUBBU PRECIOUSMETALS AND MINERALS LIMITED,Active
U74110DL2011PTC214052,OPTIEMUS TELEMATICS PRIVATE LIMITED,Active
U72900TG2017PTC118905,GANJI TECHNOLOGIES PRIVATE LIMITED,Active
U72200WB2017PTC222295,CLINMD INFOTECH PRIVATE LIMITED,Active
U36100MP2017PTC043875,PRAADIS ADVANCE PHARMACEUTICALS PRIVATE LIMITED,Active
U24100TN2017FTC118341,AQS BIOCAIR PRIVATE LIMITED,Active
U74999WB2017PTC222203,OXYQUEST ENVIROTECH PRIVATE LIMITED,Active
U72200TN2017PTC118195,AMURA BUSINESS SOLUTIONS PRIVATE LIMITED,Active
U17309MP2017PTC043936,PRAADIS APPARELS PRIVATE LIMITED,Active
U74999KA2017PTC105213,EARTH2ORBIT ANALYTIX PRIVATE LIMITED,Active
U74999MH2017PTC298813,MOMMY DIARIES CARE PRIVATE LIMITED,Active
U72900RJ2017PTC058898,MINTWORKS TECHNOLOGIES INDIA PRIVATE LIMITED,Active
U74999DL2017PTC323663,MARCHE AGRO PRIVATE LIMITED,Active
U74999WB2017PTC223006,PIVOT NET TECHNOLOGIES PRIVATE LIMITED,Active
U15490MH2017PTC300121,USD BREWING PRIVATE LIMITED,Active
U74995WB2017PTC222989,MASTER AIR COURIER & CARGO PRIVATE LIMITED,Active
U40100KL2017PTC050291,THOLANI CLEAN ENERGY PRIVATE LIMITED,Active
U72900JH2017PTC010100,NIVASAYAM SUPPORT SYSTEMS PRIVATE LIMITED,Active
U52609RJ2017PTC058844,KIRANA KING RETAIL PRIVATE LIMITED,Active
U29100DL2017PTC323597,MASK DRINKTECH PRIVATE LIMITED,Active
U01100UP2017PTC097347,CROPLAB AGRI SEEDS (INDIA) PRIVATE LIMITED,Active
U74999KA2017PTC106942,INTELLIGENT CONSUMER PRODUCTS PRIVATE LIMITED,Active
U74999GJ2017PTC099402,ASTRE RECYCLING SOLUTIONS PRIVATE LIMITED,Active
U15400MH2017PTC300667,INDIVAR NATURAL FOODS PRIVATE LIMITED,Active
U31900GJ2017PTC099253,TRANSGLOBE POWERTECH PRIVATE LIMITED,Active
U34100HR2021PTC094653,YVYT PRIVATE LIMITED,Active
U51909KA2017PTC106871,VISHRUTHA VENTURES PRIVATE LIMITED,Active
U74999OR2017PTC027521,AWALK INNOVATIONS PRIVATE LIMITED,Active
U70200TN2017PTC116541,HIRANYA VASUDHARA REAL DEVELOPERS PRIVATE LIMITED,Active
U52520GJ2017PTC098945,ULYSSES EXIM PRIVATE LIMITED,Active
U74999MH2017PTC300758,LOTUS INSIGHTS INDIA PRIVATE LIMITED,Active
U45309JH2017PTC009986,RELENT DEVELOPERS PRIVATE LIMITED,Active
U72900DL2018PTC329436,NIXXE INFOTECH PRIVATE LIMITED,Active
U41000DL2017PTC324212,JMD WATER HEALER PRIVATE LIMITED,Active
U74999PN2017PTC172919,OMNIA PROJECT CONSULTANTS PRIVATE LIMITED,Active
U45200KA2016PTC097212,TERRAXEL INFRASTRUCTURES PRIVATE LIMITED,Active
U51909WB2017PTC221537,FBA FOODS PRIVATE LIMITED,Active
U72900UP2016PTC087617,MANINTECHNOLOGY PRIVATE LIMITED,Active
U74999PN2016PTC167008,JND SOLUTIONS PRIVATE LIMITED,Active
U60100KA2016PTC097429,VIJAYANAND LOGISTICS PRIVATE LIMITED,Active
U74999TN2017PTC118999,CEMAY ENGINEERING SOLUTIONS PRIVATE LIMITED,Active
U93090DL2017PTC319201,RN STAFF PRIVATE LIMITED,Active
U74999TN2017FTC117654,AEROSPACE QUALITY SUPPLIER PRIVATE LIMITED,Active
U65999DL2017PTC320257,DGN FINLEASE PRIVATE LIMITED,Active
U74999TG2016PTC112735,SUDHA AND KOMALI PROFESSIONAL SERVICES PRIVATE LIMITED,Active
U52609KA2016PTC097595,ZETAPEGASI RETAIL PRIVATE LIMITED,Active
U74999RJ2017PTC058495,KUTCHUZ GLOBAL SOLUTIONS PRIVATE LIMITED,Active
U74999KA2017PTC106451,GSSF VENTURES PRIVATE LIMITED,Active
U74999TG2017PTC118059,OXTRA TECHNOLOGIES PRIVATE LIMITED,Active
U45200KL2017PTC049792,ZEEKON BUILDERS AND DEVELOPERS PRIVATE LIMITED,Active
U25209OR2018PTC029008,MAHESWARI POLY PLAST PRIVATE LIMITED,Active
U74999MH2017PTC297227,ADAPTIVE BLUE PRIVATE LIMITED,Active
U65999GJ2018PTC102703,NENS FOREX SERVICES PRIVATE LIMITED,Active
U63040MH2018PTC310986,SAUDADE TOURISM PRIVATE LIMITED,Active
U52602PB2018PTC048033,CONFO DEAL PRIVATE LIMITED,Active
U29309MH2017PTC296362,SUNYANTRA PRIVATE LIMITED,Active
U74999TN2018PTC123289,CAREEVER ENGINEERS AND CONSULTANTS PRIVATE LIMITED,Active
U88900MH2017PTC297442,MBTLA UDYOJAKATA KAUSHAL VIKAS SANSTHA PRIVATE LIMITED,Active
U15136DL2018PTC335154,UNIWELL PURE MEALS PRIVATE LIMITED,Active
U65990BR2018PLC038465,ABHILASHA NIDHI LIMITED,Active
U93090KA2018PTC113851,SINDHU ENTERTAINMENTS PRIVATE LIMITED,Active
U72100DL2015PTC283299,MEDICIANS SOFTWARE SOLUTIONS PRIVATE LIMITED,Active
U74999CH2018PTC042036,AEROPOLIS INFRA PRIVATE LIMITED,Active
U92419GJ2018PTC100722,AMEZEEN EVENT CONSULTANCY PRIVATE LIMITED,Active
U74999DL2018PTC327877,BARDEEN ENGG SOLUTIONS PRIVATE LIMITED,Active
U01112DL2018PTC328052,VIGNESH FARM INNOVATIONS PRIVATE LIMITED,Active
U51909DL2018PTC328079,GIRISHA FERTILISERS AND SEEDS PRIVATE LIMITED,Active
U51909DL2018PTC328050,SAHASRAJEET EQUIPMENTS AND SUPPLIES PRIVATE LIMITED,Active
U51501DL2018PTC328042,SAI ISHWARA AGRICULTURAL EQUIPMENTS AND MATERIAL PRIVATE LIMITED,Active
U72900DL2018PTC329509,EMEVEST TECHNOLOGIES PRIVATE LIMITED,Active
U51909DL2017PTC325873,MITASHU WORLDWIDE PRIVATE LIMITED,Active
U80903TG2018PTC123188,ESPERANZA TUTOR SERVICES PRIVATE LIMITED,Active
U65990KL2017PLC050997,ST. SEBASTIAN'S NIDHI LIMITED,Active
U74999KA2017PTC107995,AMIMED CURA PHARAMA PRIVATE LIMITED,Active
U72400KA2017PTC107729,BREATHWORKS SERVICES PRIVATE LIMITED,Active
U74999PN2017OPC173299,LJX LOGISTICS (OPC) PRIVATE LIMITED,Active
U74999HR2018PTC072708,VARRIDSOFTWARE SOLUTIONS PRIVATE LIMITED,Active
U74999MH2017PTC301589,GRAND PRIX CAR DETAILING PRIVATE LIMITED,Active
U74999KA2017OPC107759,LINMI CONSULTANCY SERVICES (OPC) PRIVATE LIMITED,Active
U74999JK2018PTC010333,BRENDIN ONDIGITAL PRIVATE LIMITED,Active
U74999DL2017PTC325769,ANTYA STARS TECHNOLOGIES PRIVATE LIMITED,Active
U74999KA2018PTC111358,JEMM TALENT SERVICES PRIVATE LIMITED,Active
U74999MH2018OPC304907,ARYSHNIKOV (OPC) PRIVATE LIMITED,Active
U74999MH2018PTC306607,HKG TOTAL SOLUTIONS PRIVATE LIMITED,Active
U74999PN2017PTC173274,INTLIRI CONSULTANTS PRIVATE LIMITED,Active
U90000GJ2018PTC101486,BLACKSTONE ECOSYSTEMS & PROCESSES PRIVATE LIMITED,Active
U40300PB2018PTC047497,SAEL SOLAR INDIA PRIVATE LIMITED,Active
U74999KA2018PTC110199,ELIMEC-VENTURES INDIA PRIVATE LIMITED,Active
U74999MH2018PTC306901,BJI SUPER MARKET PRIVATE LIMITED,Active
U74999RJ2018PTC060636,GBNB ADVISORY SERVICES PRIVATE LIMITED,Active
U63090DL2018PTC331053,AIROM SERVICES PRIVATE LIMITED,Active
U45200KA2018PTC110505,RICHESSE PROJECTS PRIVATE LIMITED,Active
U74999TG2018PTC122404,ESGEE GLOBAL EXIM PRIVATE LIMITED,Active
U74999MH2018PTC305250,XTRODIGY EVENTS PRIVATE LIMITED,Active
U19200DL2018PTC330578,PUNET FOOTWEARS PRIVATE LIMITED,Active
U74999WB2018PTC224941,ROLLOUS QSR PRIVATE LIMITED,Active
U15549MH2018PTC305719,JUGGERNAUT BEVERAGES PRIVATE LIMITED,Active
U15490PN2018PTC174840,URBANTASTE FOODS PRIVATE LIMITED,Active
U93000GJ2018PTC102663,HET-CHINT HEALTHCARE SERVICES PRIVATE LIMITED,Active
U93090KA2018PTC113743,MANJUNATH CINE FRAMES PRIVATE LIMITED,Active
U70200HR2018PTC072600,KGR CONTRACTOR AND SERVICES PRIVATE LIMITED,Active
U51909MP2018PTC045055,SURYAM CABLES AND ELECTRICALS PRIVATE LIMITED,Active
U74999MH2018PTC306201,INNOVATION ENCLAVE PRIVATE LIMITED,Active
U52609BR2018PTC037435,REL PHARMA PRIVATE LIMITED,Active
U01113PY2018OPC008245,NOVA TERRA AGRO VENTURES (OPC) PRIVATE LIMITED,Active
U72502TG2018PTC124533,REALDYNAMICS INDIA PRIVATE LIMITED,Active
U24304PN2018PTC176793,MAKARJYOTHI AUTOMOTIVE MATERIALS (INDIA) PRIVATE LIMITED,Active
U63030UP2018PTC104789,EL CONTENTO PRIVATE LIMITED,Active
U74999KA2018PTC113308,ZUZUHIVE TECHNOLOGIES PRIVATE LIMITED,Active
U74999MH2018PTC309386,KENOCK PRIVATE LIMITED,Active
U74999DL2018PTC334372,RAYON FOODS PRIVATE LIMITED,Active
U24299UP2018PTC104543,CHANDRA BIOCHEM PRIVATE LIMITED,Active
U24302JH2018PTC011394,LIFEZEST SOLUTIONS PRIVATE LIMITED,Active
U70109OR2017PTC027851,SOLASTA DEVELOPERS PRIVATE LIMITED,Active
U72900KA2017PTC107399,PRECEPT LABS PRIVATE LIMITED,Active
U74999MH2017OPC301287,GAURANJALI PROMOTIONS & PUBLICITY (OPC) PRIVATE LIMITED,Active
U74999DL2017PTC326681,CSB CORPORATION PRIVATE LIMITED,Active
U74999TN2017PTC119918,DCMDATALABS PRIVATE LIMITED,Active
U17309UP2017PTC099411,RKMV MULTISERVICES PRIVATE LIMITED,Active
U51909WB2017PTC223812,KAMANNA BEAUTY CONCEPTS PRIVATE LIMITED,Active
U65990TG2017PTC121075,CSAS INVESTMENTS PRIVATE LIMITED,Active
U74999KA2017PTC108433,VECTORFLOW LABS PRIVATE LIMITED,Active
U74999DL2017PTC327219,KNY HOTELS SERVICES PRIVATE LIMITED,Active
U52599WB2017PTC223945,ITISHA SALES PRIVATE LIMITED,Active
U45500TG2018PTC125436,KANKSHA CONSTRUCTIONS PRIVATE LIMITED,Active
U55100KA2017PTC108770,VRYLY HOSPITALITY PRIVATE LIMITED,Active
U27300GJ2018PTC103157,DHFF INDUSTRIES PRIVATE LIMITED,Active
U74999DL2018PTC333824,EQUBE MANAGEMENT SERVICES PRIVATE LIMITED,Active
U24290DL2018PTC336657,ETHICAL WELLNESS PRIVATE LIMITED,Active
U80101KL2018PTC054163,GRAHIK LEARNING PRIVATE LIMITED,Active
U36999GJ2018PTC103173,RUPF CREATION PRIVATE LIMITED,Active
U01100DL2020PTC368247,SRANAM INFRATECH PRIVATE LIMITED,Active
U80904KA2018PTC114931,PROSCULPTMIND ACADEMY PRIVATE LIMITED,Active
U72900KA2018PTC115173,BRIDGED CONNECT INTERNET PRIVATE LIMITED,Active
U74999MH2018PTC309035,TJPRINT SOLUTIONS PRIVATE LIMITED,Active
U74999PB2018PTC047710,DEEPPULSE LABS PRIVATE LIMITED,Active
U74999GJ2018PTC101596,VADIT HEALTH AND RESEARCH PRIVATE LIMITED,Active
U29309WB2018PTC225765,ENCASING INNOVATIONS PRIVATE LIMITED,Active
U74999WB2018PTC226075,MAINALI HR AND CAREER SERVICES PRIVATE LIMITED,Active
U65999UP2018PLC104114,SBP INDIA NIDHI LIMITED,Active
U34102KA2018PTC115159,VOLTORB INDUSTRIES PRIVATE LIMITED,Active
U93030MH2018PTC309096,TECHERA ENDEAVOUR PRIVATE LIMITED,Active
U74999UP2018PTC104106,BHUMIPUKAR INDIA SERVICES PRIVATE LIMITED,Active
U15549KA2018PTC112973,ABSOLOOP PRIVATE LIMITED,Active
U93090CH2018PTC041991,ADESH MULTI TASK PRIVATE LIMITED,Active
U15100KA2018OPC116189,GLICCHALI FOODS (OPC) PRIVATE LIMITED,Active
U51909HR2019PTC082788,FDN MARKETTING PRIVATE LIMITED,Active
U74999UR2018PTC008623,META4MARKET INTELLIGENCE PRIVATE LIMITED,Active
U74999KA2020PTC140845,SHRI SAMPRADA ACADEMY PRIVATE LIMITED,Active
U74999DL2018PTC338519,WOODNOTE ORGANICS PRIVATE LIMITED,Active
U24290PN2018PTC178546,CHROMASSURE LABS PRIVATE LIMITED,Active
U23200RJ2018PTC061143,WINGSTUD TRADING PRIVATE LIMITED,Active
U74999MH2018PTC308783,DWAMADEO NAVIGATORS AND OVERSEAS MARITIME PRIVATE LIMITED,Active
U40108MH2018PTC313590,DOIT SMART GREEN ENERGY (INDIA) PRIVATE LIMITED,Active
U52609WB2018PTC227578,KALYANI SPIRITS PRIVATE LIMITED,Active
U93090KA2018PTC117307,KANISHKHA REALTECH PRIVATE LIMITED,Active
U70100KA2018PTC117165,MTATVIR PRIVATE LIMITED,Active
U74999MH2021OPC362437,WONNE ADVISORY SERVICES (OPC) PRIVATE LIMITED,Active
U72900KA2019PTC122755,SONAKTA PRIVATE LIMITED,Active
U74999RJ2018PTC062639,TAABRO PEDAGOGY PRIVATE LIMITED,Active
U74999KA2018PTC117248,SUSHARA INSTITUTE OF SKILL TRAINING PRIVATE LIMITED,Active
U29309PN2018PTC178124,STONCETHERMAL PRIVATE LIMITED,Active
U72900TG2018PTC126076,ATAI CONTAINER SOLUTIONS PRIVATE LIMITED,Active
U52609WB2018PTC227538,SUBHRA SPIRITS PRIVATE LIMITED,Active
U74999MH2018PTC315764,ADKEM PHARMACEUTICALS PRIVATE LIMITED,Active
