CIN,Company Name,Status
U62011HR2023OPC115203,UMPRESSA TECH (OPC) PRIVATE LIMITED,Active
U97000HR2023PTC115693,ONECLICK SUPPORT SERVICES PRIVATE LIMITED,Active
U78100KA2023OPC179782,HERNAN SOLUTIONS (OPC) PRIVATE LIMITED,Active
U62099HR2023PTC117620,VIQRDATA TECHNOLOGIES PRIVATE LIMITED,Active
U66309DL2023PTC424331,SAMBHAWNA TRADING PRIVATE LIMITED,Active
U25933HR2023PTC117487,SILBERTOOL SOLUTIONS GLOBAL PRIVATE LIMITED,Active
U47219DL2023PTC424287,A&D SHINE INTERNATIONAL PRIVATE LIMITED,Active
U42201PB2023PTC060172,MINALTERV PROJECTS PRIVATE LIMITED,Active
U85500HR2023PTC117420,ACADQUEST INTERNATIONAL PRIVATE LIMITED,Active
U82990HR2023FTC116958,CLAAS INDIA GLOBAL SERVICES PRIVATE LIMITED,Active
U73100RJ2023PTC091225,SELLERICA ENTERPRISES PRIVATE LIMITED,Active
U70200RJ2023OPC091600,APPAROQ SOLUTIONS (OPC) PRIVATE LIMITED,Active
U64990MP2024PTC069552,GAURUM SECURITIES PRIVATE LIMITED,Active
U63122HR2024PTC118925,UNTANGLE CODE PRIVATE LIMITED,Active
U46593UP2024PTC197268,EAZYSWITCH INDIA PRIVATE LIMITED,Active
U43299HR2024PTC119534,DAT INTERIOR DEVELOPERS PRIVATE LIMITED,Active
U70200KL2024PTC086509,GP EDUCATION AND MIGRATION SOLUTIONS PRIVATE LIMITED,Active
U66220DL2024PTC430614,ALT PROTECT INSURANCE BROKERS PRIVATE LIMITED,Active
U63990KL2024PTC088850,LINKYBINKY PRIVATE LIMITED,Active
U86200UP2024PTC206338,LOKAMAITRI HEALTH TECH PRIVATE LIMITED,Active
