CIN,Company Name,Status
U72200TG2021PTC150549,KHEYEH SYSTEMS INDIA PRIVATE LIMITED,Active
U72900KA2019OPC120359,PYZA LABS INDIA (OPC) PRIVATE LIMITED,Active
U80302HR2019PTC078064,ADVANCE EDULOGY PRIVATE LIMITED,Active
U72900HR2018PTC072274,RSC SOFTWARE LABS PRIVATE LIMITED,Active
U74999HR2019PTC078312,YAA INFRATECH PRIVATE LIMITED,Active
U52609HR2019PTC078696,YAA AUTOMOBEX PRIVATE LIMITED,Active
U74999HR2019PTC078941,HT LOGISTICS PRIVATE LIMITED,Active
U40106AP1986PTC006129,ELITE PROCON SOLUTIONS PRIVATE LIMITED,Active
U45200TG2004PTC042984,LAKSHMI SANHITH CONSTRUCTIONS PRIVATE LIMITED,Active
U72900RJ2022PTC083618,SUIWAL TECHNOLOGY PRIVATE LIMITED,Active
U52609HR2022PTC106445,VJRG INDIA PRIVATE LIMITED,Active
U45309TZ2022PTC039880,SQUARE EDGE INFRATECH PRIVATE LIMITED,Active
U15499GJ1986PTC008731,SUN FOODS PRIVATE LIMITED,Active
U27104AS1994PLC004201,B N FABRICATORS LIMITED,Active
U45202AS1999PTC005815,EXPLORATION TECHNOLOGY INDIA PRIVATE LIMITED,Active
U74999HR2022PTC106529,SOCIAL SPONGE PRIVATE LIMITED,Active
U67190HR1996PTC033114,SHREE CHINTAMANI FINVEST PVT LTD,Active
U45400KA1991PTC011626,JERMONICA HOUSING & INFRASTRUCTURE PRIVATE LIMITED,Active
U72900KA1999PTC025545,RCS EDUCATION PRIVATE LIMITED,Active
U15209KA1989PTC009910,SIDDHARTA ICE-CREAMS PRIVATE LIMITED,Active
U72900KA2022PTC166333,SONICBOOM SERVICES PRIVATE LIMITED,Active
U72900KA2004PTC033752,BIZMENTORS PRIVATE LIMITED,Active
U74140MP1995PLC010063,PITAMBRA CORPORATE CONSULTANCY LIMITED,Active
U70100HR2022PTC106638,OAHFEO VENTURES PRIVATE LIMITED,Active
U72900UP2022OPC170943,MELADUNIX (OPC) PRIVATE LIMITED,Active
U28939PB1992PTC012670,PASHUPATI STEELS INDIA PRIVATE LIMITED,Active
U27107RJ1994PTC008571,MAHESH METALS PRIVATE LIMITED,Active
U24232RJ2003PTC018384,SAIBLISS HEALTH CARE PRIVATE LIMITED,Active
U17219CH1995PTC015697,GIANI TEXTILES PVT LTD,Active
U74899DL1990PTC039001,MT. ABU RESORTS PRIVATE LIMITED,Active
U74899DL1994PTC058627,G D COMPUTERS PRIVATE LIMITED,Active
U74899DL1993PTC055949,SRJ AND ASSOCIATES PRIVATE LIMITED,Active
U74899DL1995PTC068346,SEAROCK SECURITIES PRIVATE LIMITED,Active
U51909DL1995PTC071332,TANEJA MINES PRIVATE LIMITED,Active
U74140DL1997PTC086967,RESOLUTION CONSULTANCY SERVICES PRIVATE LIMITED,Active
U74920DL2003PTC123218,ABACUS SECURITY SERVICES PRIVATE LIMITED,Active
U18101DL2004PTC129181,MAHESHWARI CREATIONS PRIVATE LIMITED,Active
U51909DL2002PTC117817,SAJAG TECHNOLOGIES PRIVATE LIMITED,Active
U74140DL2005PTC141359,DESMACON DESIGN AND MARKETING CONSULTANTS PRIVATE LIMITED,Active
U28939TZ1970PLC000617,SOUTHERN PRESS TOOLS LIMITED,Active
U71210DL2007PTC165922,TECHNOAPEX SOFTWARE PRIVATE LIMITED,Active
U85100GA2007PTC005282,FITNESS INNOVATION TECHNOLOGIES PRIVATE LIMITED,Active
U40300DL2008PLC172487,INDUS GAS TRANSMISSION LIMITED,Active
U72900DL2007PTC163372,FORTUNE TECHNOPARKS PRIVATE LIMITED,Active
U74140KA2007PTC044395,STRATOS MANAGEMENT SERVICES PRIVATE LIMITED,Active
U34300TN2008PTC067209,PRECISION STEELS TURNED PARTS PRIVATE LIMITED,Active
U52110TZ2006PLC012945,ABT FOODS RETAILING (INDIA) LIMITED,Active
U40109KA2001PTC028637,SUNTRAC ENERGY SYSTEMS PRIVATE LIMITED,Active
U01405GJ2008PTC054682,DHANRAJ COTTON PRIVATE LIMITED,Active
U74900KA2009PTC049394,TRANSCENDENZ MARKTECH CONSULTANCY SERVICES (INDIA) PRIVATE LIMITED,Active
U74900DL2009PTC189982,FIRSTCORP INVESCO PRIVATE LIMITED,Active
U00000DL2001PTC109984,DREAM TECH EXPORTS PRIVATE LIMITED,Active
U14294RJ2022PTC084043,STONVERSE DRC MARKETPLACE PRIVATE LIMITED,Active
U74992DL2010PTC198540,JITIN AGRO PRODUCTS PRIVATE LIMITED,Active
U85100DL2010PTC203935,MOBILE HEALTH SOLUTIONS PRIVATE LIMITED,Active
U40101HR2010PLC040909,OMAX AEROSPACE AND DEFENCE LIMITED,Active
U74140DL2010PTC209880,HEXAGRAMM DESIGN PRIVATE LIMITED,Active
U51909DL2011PTC214326,SOGA COMMODITIES PRIVATE LIMITED,Active
U45201OR2010PTC012573,SAI HOMETECH PRIVATE LIMITED,Active
U72200TG2010PTC066544,CORPONE OUTSOURCING PRIVATE LIMITED,Active
U31102RJ2009PTC030231,SUPER POWER TRANSFORMERS PRIVATE LIMITED,Active
U40300HR2010PTC039945,NIPRA POWER GEN PRIVATE LIMITED,Active
U65923UP2011PLC044901,RAMA INDIA INTERMEDIATES LIMITED,Active
U29253HR2011PTC050129,LIMITLESS ENGINEERS ALLIANCE PRIVATE LIMITED,Active
U74140PB2011PTC035294,S KHURANA CORPORATE ADVISORS PRIVATE LIMITED,Active
U80302RJ2009PTC028788,INFOMATRIX COMPUTERHUB PRIVATE LIMITED,Active
U28113DL2012PTC234427,STARDECK PRODUCTS PRIVATE LIMITED,Active
U26941GJ2009PLC057757,ADESHWAR INFRABUILD LIMITED,Active
U85100KA2012PTC063805,ARKIN LIFE SCIENCES PRIVATE LIMITED,Active
U72200KA2012PTC065058,STUN-A-REVE SOLUTIONS PRIVATE LIMITED,Active
U74140DL2013PTC253805,PATHFINDERS MEDIA PRIVATE LIMITED,Active
U74999HR2013PTC049361,EUPHORIASQUAD INNOVATION PRIVATE LIMITED,Active
U74140HR2013PTC049240,E7 PROCESSING SERVICES PRIVATE LIMITED,Active
U72900DL2013PTC247641,TECHVILLA IT SERVICES PRIVATE LIMITED,Active
U70101DL2013PTC248147,MANSI BUILDTECH PRIVATE LIMITED,Active
U74140DL2012PTC246594,ETASH MANAGEMENT SERVICES PRIVATE LIMITED,Active
U93090HR2011PTC044312,THE OFFICE GUYS SERVICES INDIA PRIVATE LIMITED,Active
U63000DL2012PTC245119,RUSH TRAVEL PRIVATE LIMITED,Active
U74900TN2011PTC083414,BVAST MANAGEMENT CONSULTANTS PRIVATE LIMITED,Active
U74999HR2012PTC045568,FITNESS ANTHEM GYM & SPA PRIVATE LIMITED,Active
U72900CH2012PTC034101,MIRUS LABS PRIVATE LIMITED,Active
U72400DL2012PTC242726,CAB CLINICAL SERVICES INDIA PRIVATE LIMITED,Active
U74999TN2012PTC087769,GRUHAS PROPERTY ADVISORS PRIVATE LIMITED,Active
U63000HR2014PTC052643,UNEXPLORED LIFESPACES PRIVATE LIMITED,Active
U85100HR2011PTC043512,ENTELEQI PROGNOSTICS PRIVATE LIMITED,Active
U40300MP2013PTC031510,INFOALLIANCE RENEWABLE ENERGY PRIVATE LIMITED,Active
U72200KA2011PTC059851,E-ACTIVITIES TECHNOLOGIES PRIVATE LIMITED,Active
U71210HR2011PTC043887,R K CRANES PRIVATE LIMITED,Active
U72900TN2013PTC091507,SHYPO TECHNOLOGIES PRIVATE LIMITED,Active
U40109DD2013PTC004727,WIND WORLD WIND FARMS (TAPTI) PRIVATE LIMITED,Active
U70102WB2013PTC196030,VEDAVITA INFRAHEIGHT PRIVATE LIMITED,Active
U70102WB2013PTC193317,DURGESHWARI CONCLAVE PRIVATE LIMITED,Active
U74140HR2014PTC053757,QUANTUM SECURITY SOLUTION PRIVATE LIMITED,Active
U15494GJ2013PTC073672,BHOOMI ORGANIC PRODUCTS PRIVATE LIMITED,Active
U24230GJ2013PTC077735,FLORENTT BIOPHARMA PRIVATE LIMITED,Active
U74999DL2014PTC267843,LALAJI 24X7 ECOMMERCE PRIVATE LIMITED,Active
U74140HR2014PTC051999,READY MERCHANTLINKS PRIVATE LIMITED,Active
U72200UP2006PTC031645,SEASONS COMPUTER EDUCATION PRIVATE LIMITED,Active
U45202UP2014PTC063217,J.B.SHRINIWAS INFRAHEIGHT PRIVATE LIMITED,Active
U72900HR2014PTC052071,SPECTRUM GLOBAL TECHSERVE PRIVATE LIMITED,Active
U65992TG2014PTC093004,PRIKI CHITS INDIA PRIVATE LIMITED,Active
U80902HR2014PTC051800,NSTONE PANELS PRIVATE LIMITED,Active
U74999HR2015PTC056304,VSGS ENTERPRISES PRIVATE LIMITED,Active
U74900WB2015PTC207557,PURNESHWARI JUCO AND ALLIED FABRICS PRIVATE LIMITED,Active
U72200KA2016PTC085274,PMES TECHNO SERVICES PRIVATE LIMITED,Active
U55101HR2015OPC056961,TRUEBRAT (OPC) PRIVATE LIMITED,Active
U85191DL2013PTC261421,SAP HEALTH SOLUTIONS PRIVATE LIMITED,Active
U65992KL2013PTC035392,CHANKOOR CHITS PRIVATE LIMITED,Active
U74140DL2015PTC283748,PANCH TATVA CONSULTING PRIVATE LIMITED,Active
U74140DL2015PTC285550,JA INDIA DIGITAL PRIVATE LIMITED,Active
U45201RJ2014PTC044818,ARHAM GREENS PRIVATE LIMITED,Active
U64200DL2015PTC279755,TRIJAL DIGITAL MEDIA PRIVATE LIMITED,Active
U74140DL2015PTC281801,CYANKART INDIA PRIVATE LIMITED,Active
U60300HR2015PTC054590,SHIVPRIYA LOGISTICS PRIVATE LIMITED,Active
U74900KA2016PTC191856,HOUNDSHARK DELHI PRIVATE LIMITED,Active
U74995GA2016PTC012889,DESIREE HOMES & RESORTS PRIVATE LIMITED,Active
U51909KL2016PTC045871,HANN BIOGENICS PRIVATE LIMITED,Active
U31500DL2015PTC276397,MANAS SYSTECH PRIVATE LIMITED,Active
U74140DL2015PTC276342,MOBITRON GADGETS PRIVATE LIMITED,Active
U74140HR2015PTC054974,EKATRRA ECOMMERCE PRIVATE LIMITED,Active
U70102WB2013PTC193316,DURGESHWARI ENCLAVES PRIVATE LIMITED,Active
U67100TN2016PLC111713,VATCHALA HOUSING FINANCE LIMITED,Active
U74999HR2016PTC065047,STEMZ ONCOLOGY PRIVATE LIMITED,Active
U72900GJ2016PTC093276,VARISHTHA SOFT-TECH PRIVATE LIMITED,Active
U60221HR2016PTC065401,RIVIGO FREIGHT PRIVATE LIMITED,Active
U51909TR2016PTC013489,AGARTALA MERCHANDISE PRIVATE LIMITED,Active
U17291WB2015PTC205297,GOPANATH LIFESTYLE PRIVATE LIMITED,Active
U70200RJ2017PTC057916,KATIA REALTY SOLUTIONS PRIVATE LIMITED,Active
U85190HR2016PTC063779,MEDBRIO PRIVATE LIMITED,Active
U72200DL2016OPC299072,OPSGAIN TECHSOL SERVICES (OPC) PRIVATE LIMITED,Active
U65999KL2016PLC045781,WELLGROW NIDHI LIMITED,Active
U45500GJ2016PTC094092,KHODAL WEAVETECH PRIVATE LIMITED,Active
U70100TG2016PTC109596,SWARNASHUBHA BHOOMI PRIVATE LIMITED,Active
U63030DL2016PTC299396,CHEAP MY TICKET PRIVATE LIMITED,Active
U74999TG2016PTC111839,LASYASREE INFOTECH PRIVATE LIMITED,Active
U55101HP2017PTC006540,UNRAU KAFFEE PRIVATE LIMITED,Active
U33300TG2017PTC117005,SRIYA MEDTECH PRIVATE LIMITED,Active
U74999HR2017PTC070146,SATTWA WELLNESS PRIVATE LIMITED,Active
U74999DL2017PTC321525,OUT OF SCALE STUDIO PRIVATE LIMITED,Active
U52399TN2017PTC117897,ARMANS ATTIRES PRIVATE LIMITED,Active
U51909DL2017PTC321597,SLEEP SYSTEMS PRIVATE LIMITED,Active
U74999DL2017PTC324430,CHUBBY CAT MEDIA PRIVATE LIMITED,Active
U74999HR2017PTC069429,S.B. FELTS PRIVATE LIMITED,Active
U72900TG2017PTC117606,MAGNIZENT TECHNOLOGIES PRIVATE LIMITED,Active
U74999HR2017PTC070659,INNER GRAM PRIVATE LIMITED,Active
U74999KL2016PTC047171,PINSTOVE PRIVATE LIMITED,Active
U72900HR2018PTC072448,CSS SOFTLAB PRIVATE LIMITED,Active
U01113KA2018PTC111595,AGBOT PRIVATE LIMITED,Active
U24100HR2018PTC073109,STAMBH HEALTHCARE PRIVATE LIMITED,Active
U74110TG2016PTC113489,WIPING BORDERS CONSULTING PRIVATE LIMITED,Active
U35122HR2016PTC058298,HEADS WORLDWIDE PRIVATE LIMITED,Active
U93030DL2018PTC329773,EXURE TECHNOLOGIES PRIVATE LIMITED,Active
U65990RJ2018PLC061405,S.V.F.I. NIDHI LIMITED,Active
U74999HR2018PTC074065,ELEMENSYS TECHNOLOGIES PRIVATE LIMITED,Active
U74999HR2018PTC074409,BUDHA MAGIC TRICK & TOYS PRIVATE LIMITED,Active
U45202DL2005PTC334759,KUBER TOWNSHIP PRIVATE LIMITED,Active
U74999TG2018PTC124672,LMANDALA SINCE1700 PRIVATE LIMITED,Active
U45309PB2018PTC047929,RS CREATORS PRIVATE LIMITED,Active
U74999GJ2017PTC099651,JGEA CONSULTANTS PRIVATE LIMITED,Active
U74999HR2017PTC071704,RUNWAY CONSULTING PRIVATE LIMITED,Active
U65992TN2017PTC120142,CHENNAI KARAMBAKKAM CHIT FUND PRIVATE LIMITED,Active
U74999KA2018PTC114981,KRIMLAN PRIVATE LIMITED,Active
U74999GJ2018PTC102090,DOYEN HOTELS PRIVATE LIMITED,Active
U74999DL2018PTC336951,ALAGH INSTANT TRANSFER PRIVATE LIMITED,Active
U45500AP2018PTC108368,NIYON VENTURES AND PROJECTS PRIVATE LIMITED,Active
U85320UP2018OPC107540,SUAHIM HEALTH AND PHARMA (OPC) PRIVATE LIMITED,Active
U01100KA2018PTC115972,MPLS AGRITECH PROJECT PRIVATE LIMITED,Active
U36999DL2018OPC337587,AXZON INTERIOR (OPC) PRIVATE LIMITED,Active
U72900HR2018PTC076354,DRTECH CONSULTANCY PRIVATE LIMITED,Active
U74999HR2018PTC075213,COLMADO BUSINESS SOLUTIONS PRIVATE LIMITED,Active
U50400DL2018PTC338986,MAVENTECH INNOVATIONS PRIVATE LIMITED,Active
U80904PB2018PTC047750,NAUNIDH EDUCATION PRIVATE LIMITED,Active
U74999JK2018PTC010382,INNOKRATS SOLUTIONS PRIVATE LIMITED,Active
U80300KA2018PTC112212,KAVANE EDUCORP PRIVATE LIMITED,Active
U80302KA2018PTC116982,IMMUNITEIT LABS PRIVATE LIMITED,Active
U74999DL2018PTC341803,CERTIVERIFY TECHNOLOGIES PRIVATE LIMITED,Active
U29309GJ2018PTC105222,KEVIT INDUSTRIAL TECHNOLOGIES PRIVATE LIMITED,Active
U72900UP2019PTC116309,3SMIND TECHNOLOGIES PRIVATE LIMITED,Active
U29100TN2019PTC129213,CIRCLES ELEVATORS & ESCALATORS PRIVATE LIMITED,Active
U51909GJ2019PTC108138,RIWAI DESIGN BRIDGE PRIVATE LIMITED,Active
U63031HR2019PTC080518,VINCIT GLOBAL TRAVELS PRIVATE LIMITED,Active
U72900UR2019PTC009881,UMRC TECHNOLOGIES PRIVATE LIMITED,Active
U72200RJ2019PTC064708,HYPEDGE MEDIA AND PROMOTIONS PRIVATE LIMITED,Active
U74999TG2018PTC127902,SAVER'S HUB PRIVATE LIMITED,Active
U51909UP2018PTC109515,TIJORIX DESIGNS PRIVATE LIMITED,Active
U20100GJ2015PTC083293,SINO CRYSTAL PRIVATE LIMITED,Active
U85300HR2019PTC080105,NAYONIKA IVF & LAPROSCOPY CENTRE PRIVATE LIMITED,Active
U24304DL2019PTC350220,HOIVO HEALTHCARE PRIVATE LIMITED,Active
U67100OR2019PTC031037,KAJA HI FIN CONSULTANCY PRIVATE LIMITED,Active
U92400HR2019PTC079184,WILDTOD TECHNOLOGIES PRIVATE LIMITED,Active
U72900HR2018OPC077292,FUTUREGRID TECHNOLOGIES (OPC) PRIVATE LIMITED,Active
U51909HR2019PTC082793,JAI LAL TRADEX INDIA PRIVATE LIMITED,Active
U72900TN2019PTC130707,HOTOLIA TECHNOLOGIES PRIVATE LIMITED,Active
U45201UP2019PTC115869,SNAN & SONS PRIVATE LIMITED,Active
U74999HR2019PTC082761,JEDAR INDUSTRIES INDIA PRIVATE LIMITED,Active
U22219KA2019PTC129825,BABUGOSHA VENTURES PRIVATE LIMITED,Active
U51100TN1999PTC043517,RIJHWANI TRADING PRIVATE LIMITED,Active
U74120HR2019PTC083786,SVOD CONSULTING INDIA PRIVATE LIMITED,Active
U72900KA2019PTC128935,AMEYASMART LABS VENTURES PRIVATE LIMITED,Active
U63040UP2019PTC118847,BANDHAN EXPERIENCES PRIVATE LIMITED,Active
U72900DL2019PTC352372,AISWIN PRIVATE LIMITED,Active
U74999KL2019SGC058822,THIRUVANANTHAPURAM INTERNATIONAL AIRPORT LIMITED,Active
U74994KA2020PTC132147,SAREEREBORN PRIVATE LIMITED,Active
U74999KA2020PTC134305,SUVANI CONSULTING SERVICES PRIVATE LIMITED,Active
U31900GJ2020PTC112157,PHP VORTEX INDUSTRIES PRIVATE LIMITED,Active
U51909DL2020PTC359711,MOFASA INTERNATIONAL PRIVATE LIMITED,Active
U74999KA2020PTC133265,DHAVALAGI ENTERTAINERS PRIVATE LIMITED,Active
U93090HR2020PTC085722,FRESHMEN TECH SOLUTIONS PRIVATE LIMITED,Active
U25202HR2020PTC087287,BGSS EXCLUSIVE PRODUCTS PRIVATE LIMITED,Active
U15490KA2020PTC133187,GEOMANUS PRIVATE LIMITED,Active
U74999TG2020PTC138751,BOONFARM ENVIRONMENTAL SCIENCE PRIVATE LIMITED,Active
U72900HR2020PTC084684,APTNESS INFOTECH PRIVATE LIMITED,Active
U74999UP2020PTC131647,CAPITAPLUS PRIVATE LIMITED,Active
U26994DL2020PLC370997,BBEL LIMITED,Active
U67100TN2020PTC138417,CIRCLES FINANCIAL SOLUTIONS PRIVATE LIMITED,Active
U29305WB2020PTC240020,MOVIMIENTO INDUSTRIAL PRIVATE LIMITED,Active
U28999MP2020PTC052921,KAILAMATA ALUMINIUM EXTRUSION PRIVATE LIMITED,Active
U26999WB2020PTC239796,GREYDUST INDIA PRIVATE LIMITED,Active
U72900KL2020PTC064449,DOPEWEAVE SAFETY TECHNOLOGY PRIVATE LIMITED,Active
U11100UP2020PTC129589,ATA INDIA FUELS PRIVATE LIMITED,Active
U70109GA2020PTC014492,BEACH VILLAGE PRIVATE LIMITED,Active
U72900TG2020PTC143019,CDI SYSTEMS PRIVATE LIMITED,Active
U74900KA2020PTC137216,DESLANCE PRIVATE LIMITED,Active
U65990MP2020PLN052278,SOMANI SILVER NIDHI LIMITED,Active
U15100KA2019OPC129196,MORAPAY (OPC) PRIVATE LIMITED,Active
U74999KA2020PTC136915,AAKMA ALLIANCE (INDIA) PRIVATE LIMITED,Active
U15400DL2020PTC365150,BOILINGPOINT FOOD SERVICE PRIVATE LIMITED,Active
U31909DL2020PTC366341,CPSC VENTURES PRIVATE LIMITED,Active
U72900HR2020PTC087443,JOYWIN TECHNOLOGY PRIVATE LIMITED,Active
U15490WB2020PTC239472,SERENITY NATURAL & ORGANIC PRODUCTS PRIVATE LIMITED,Active
U62100DL2020PTC369230,AMRUT AVIATION PRIVATE LIMITED,Active
U24290MP2020PTC053550,VAADIRAJ INDUSTRIES PRIVATE LIMITED,Active
U74999OR2021PTC035535,JAI JAGANNATH MOBILITY CONSULTANCY PRIVATE LIMITED,Active
U50400UP2021PTC141049,AASP PETROLEUM PRIVATE LIMITED,Active
U92410HR2020PTC090169,MOKSHA TRADING HUB PRIVATE LIMITED,Active
U18209KA2020OPC139817,CHOWDESHWARI VENTURES (OPC) PRIVATE LIMITED,Active
U01100HR2020PTC090294,THINK EARTH FARMERS PRODUCER COMPANY LIMITED,Active
U18109HR2021PTC092340,SHWE'S INNOVATION LABS PRIVATE LIMITED,Active
U72900KA2020PTC142566,DELOUNIX DIGITAL SOLUTIONS PRIVATE LIMITED,Active
U72900UP2020OPC139387,MILLENNIAL STUDIOS (OPC) PRIVATE LIMITED,Active
U52399WB2020PTC241970,KOREL SYSTEMS PRIVATE LIMITED,Active
U45201GJ2020PTC118296,MAKLER METRO PRIVATE LIMITED,Active
U72900RJ2020PTC072220,ROBOSYSFORCE IT PRIVATE LIMITED,Active
U16009DL2008PTC173860,KUBER PRODUCTS INDIA PRIVATE LIMITED,Active
U51909KA2020PTC138016,GRANVINO PRIVATE LIMITED,Active
U72900GJ2021PTC119393,ESHIA CONSTRUCTION PRIVATE LIMITED,Active
U45309RJ2021PTC074994,K&C CONTRACTORS PRIVATE LIMITED,Active
U15400KA2021PTC147644,SNDAYS GROCERANT PRIVATE LIMITED,Active
U72900DL2021FTC381193,KYVU INDIA PRIVATE LIMITED,Active
U31909DL2021PTC379014,DEKI ENERGY PRIVATE LIMITED,Active
U85100HR2021OPC094911,SCANORAD TELERADIOLOGY SERVICES (OPC) PRIVATE LIMITED,Active
U72900AP2021PTC118255,TRIBHUJA TECHNOLOGIES PRIVATE LIMITED,Active
U67100TN2021PTC143334,EZEE REMITTANCE PRIVATE LIMITED,Active
U74999DL2021PTC380105,TECH BOON MANAGEMENT SYSTEMS PRIVATE LIMITED,Active
U45309KL2021PTC070394,VST INFRA SOLUTIONS PRIVATE LIMITED,Active
U36990KA2021PTC151211,KOPPAL TOYS TOOLING COE PRIVATE LIMITED,Active
U36994GJ2021PTC121048,YOGINI KUMARI WANKANER PRIVATE LIMITED,Active
U55101KA2021PTC144228,SQUARE BOWL PRIVATE LIMITED,Active
U85100HR2021PTC093067,MA INFERTILITY AND SURGICAL CENTRE PRIVATE LIMITED,Active
U52520RJ2021PTC076664,AAROO PHYGITAL PRIVATE LIMITED,Active
U55209HR2021PTC096088,R PLAZA HOSPITALITY SERVICES PRIVATE LIMITED,Active
U74999KA2021PTC149185,OPSMITRA IT AND PROCUREMENT SOLUTIONS PRIVATE LIMITED,Active
U51909GA2021PTC014720,EURIMPEX INTERNATIONAL PRIVATE LIMITED,Active
U72900HR2021PTC093388,RESOLUTION INTELLIGENCE PRIVATE LIMITED,Active
U52520WB2021PTC244366,WHITELEMON RETAIL PRIVATE LIMITED,Active
U15549HR2021PTC098399,FUTURE ZONE FOODS PRIVATE LIMITED,Active
U24100HR2021PTC096187,ALLWALKS HEALTHCARE PRIVATE LIMITED,Active
U55101HR2021PTC098656,FUN VEGAS PRIVATE LIMITED,Active
U74999UP2021PTC154116,PESA24 TECHNOLOGY PRIVATE LIMITED,Active
U72900GJ2021PTC124617,V1ADUCT TECHNOLOGIES PRIVATE LIMITED,Active
U80900HR2021PTC096561,GEOMETIC EDUSERVICES PRIVATE LIMITED,Active
U74999HR2021PTC099099,NXTTGENN FOREIGN EDUCATION CONSULTANTS PRIVATE LIMITED,Active
U71290DL2021PTC390991,E-TRON EV CHARGING PRIVATE LIMITED,Active
U15400TG2021PTC157056,PROPFOODS PRIVATE LIMITED,Active
U74999TN2021PTC148750,S.P.GLOBAL FACILITY MANAGEMENT PRIVATE LIMITED,Active
U80900TG2022PTC159110,PROKID EDU SOLUTIONS PRIVATE LIMITED,Active
U64200HR2022PTC101599,GAONWANI NETWORK PRIVATE LIMITED,Active
U37100TZ2022PTC038145,SOTEK RECYCLING PRIVATE LIMITED,Active
U72900TN2021PTC148450,NYIT SOFTWARE SERVICES PRIVATE LIMITED,Active
U51909DL2022PTC392106,INDIA INK. CRAFT AND HANDLOOM PRIVATE LIMITED,Active
U31904HR2021FTC099719,PEER SYSTEMS PRIVATE LIMITED,Active
U45309DL2022PTC401848,ENVIROCRETE INDIA PRIVATE LIMITED,Active
U74999UP2022PTC167170,DOT LEGAL PRIVATE LIMITED,Active
U92490DL2022OPC392867,ENSOKYO MEDIA (OPC) PRIVATE LIMITED,Active
U74999UP2022PTC158267,PICHAIS TRADE CONSULTANT PRIVATE LIMITED,Active
U74999KA2022PTC164075,COLLARDESK INFOTECH SOL PRIVATE LIMITED,Active
U72900TG2022PTC159722,PROPQ TECHNOLOGIES PRIVATE LIMITED,Active
U92490KL2022PTC076898,VENMONY HARMONY VENTURES PRIVATE LIMITED,Active
U80301KL2022OPC073990,CONNECTOR PRO EDUCATION (OPC) PRIVATE LIMITED,Active
U72900KA2022PTC157719,FUVERSE TECHNOLOGIES PRIVATE LIMITED,Active
U74999UP2021PTC155794,CRICBOSS PRIVATE LIMITED,Active
U80902HR2021PTC098916,MEDINEXT EDUCARE PRIVATE LIMITED,Active
U74920UP2022PTC159457,ZIETRAD PRIVATE LIMITED,Active
U46697TR2023OPC014309,GLOMODANISTA (OPC) PRIVATE LIMITED,Active
U74999PB2022PTC055244,DOADVO PRIVATE LIMITED,Active
U74999TG2021PTC157983,REDBIRD RETAIL SERVICES PRIVATE LIMITED,Active
U72900HR2022PTC105616,RUBICSCUBEADVERTISING PRIVATE LIMITED,Active
U80900UP2022PTC167713,PREPTREASURES EDTECH PRIVATE LIMITED,Active
U72500KA2022PTC164102,NGAGINE INTEGRATED SOLUTIONS PRIVATE LIMITED,Active
U45309KL2022PTC077045,VIBEMED CONCEPTS MEDICAL EQUIPMENTS AND CONTRACTING PRIVATE LIMITED,Active
U92113HR2022PTC105553,COLLAB FILMS CREATION PRIVATE LIMITED,Active
U51397WB2022PTC252006,SHRESTADEVJEET PRIVATE LIMITED,Active
U15490TG2022OPC160369,OORINCHI FOODS (OPC) PRIVATE LIMITED,Active
U72200WB2022PTC252070,CONSENTIUM AUTOMATION PRIVATE LIMITED,Active
U72900UP2022PTC161964,SAAYASOFT PRIVATE LIMITED,Active
U63030TZ2022OPC038561,ARL TRANS XPRESS (OPC) PRIVATE LIMITED,Active
U70109GJ2022PTC130614,NAGAR ROAD BUSINESS HUB PRIVATE LIMITED,Active
U78300PB2023PTC060017,AXTRICS STAFFING SERVICES PRIVATE LIMITED,Active
U82990UP2023PTC192613,V4 FINANCIAL TECHNOLOGIES PRIVATE LIMITED,Active
U80902UP2022PTC161842,EDUKANKSHA LEARNINGS PRIVATE LIMITED,Active
U74999HR2022PTC103720,ACCOUNTCAFE PRIVATE LIMITED,Active
U80301HR2022PTC104061,INSURER ZONE PRIVATE LIMITED,Active
U26999DL2022PLC397610,ASAHI INDIA FLAT GLASS LIMITED,Active
U31900GJ2022PTC130125,TUNIC FUTURE PRODUCTS PRIVATE LIMITED,Active
U70109MP2022PTC061639,REAL ERA INFRATECH PRIVATE LIMITED,Active
U37200HR2022PTC104674,REIFEN PROCESSORS PRIVATE LIMITED,Active
U40106GJ2022OPC132947,SARVOTTAM SOLAR (OPC) PRIVATE LIMITED,Active
U74999AP2022PTC122538,SCALERHINO PRIVATE LIMITED,Active
U67100WB2022PTC254090,RAKRAS SOLUTIONS PRIVATE LIMITED,Active
U74300WB2022PTC256402,MEDIAKULT PRIVATE LIMITED,Active
U72900KA2022PTC165116,MIASIESTAAI PRIVATE LIMITED,Active
U72900DL2022PTC399162,GALACTIC INNOVATIONS PRIVATE LIMITED,Active
U60100HR2022PTC105852,P K ROAD CARRIER PRIVATE LIMITED,Active
U80301PB2022PTC055605,RIGHT2FLIGHT IMMIGRATION SERVICES PRIVATE LIMITED,Active
U52605CH2022OPC044309,NYCAZA (OPC) PRIVATE LIMITED,Active
U63040DL2022PTC398116,RAPIDEXO LOGISTICS SOLUTIONS PRIVATE LIMITED,Active
U72900KA2022PTC159903,ANSTAND IT SYSTEMS PRIVATE LIMITED,Active
U22190HR2022PTC104588,BOOKCYCLE LITERARY SOLUTIONS PRIVATE LIMITED,Active
U74999KA2022OPC161305,CONCLUANT BUSINESS CONSULTANTS (OPC) PRIVATE LIMITED,Active
U73100GJ2022PTC132668,BASTION RESEARCH PRIVATE LIMITED,Active
U55200DL2022PTC405721,SARVANANDA HOSPITALITY PRIVATE LIMITED,Active
U45400UP2022PTC171945,RED CIRCLE INFRATECH PRIVATE LIMITED,Active
U25190DL2022PTC405869,SUPERIOR LATEX INDUSTRIES PRIVATE LIMITED,Active
U55101UP2022PTC172444,SHRI SHYAM BABA HOSPITALITY PRIVATE LIMITED,Active
U72900DL2022PTC406388,HEDGECRAFT TECHNOLOGIES PRIVATE LIMITED,Active
U72900WB2022FTC258030,STICKY IO INDIA PRIVATE LIMITED,Active
U24290GJ2022PTC137169,SAHEL REMEDIES PRIVATE LIMITED,Active
U72900HR2022PTC108164,MELYORA TECHNOLOGIES PRIVATE LIMITED,Active
U45400WB2022PTC258563,SRIDDHIPATI CONSTRUCTION PRIVATE LIMITED,Active
U74999DL2023PTC409638,STYLRAX E-RETAIL PRIVATE LIMITED,Active
U50400TG2023PTC170083,HICCUP SOLUTIONS PRIVATE LIMITED,Active
U72900DL2022PTC408871,TASVA TRACKING SOLUTION PRIVATE LIMITED,Active
U51909HR2022PTC107747,FARIDABAD DISTRIBUTIONS PRIVATE LIMITED,Active
U68100PB2023PTC057845,KSS HOMES DEVELOPER PRIVATE LIMITED,Active
U46909HR2023PTC110450,JETHI EXIM ASK PRIVATE LIMITED,Active
U24106GJ2023PTC139096,GLOWMET ENGINEERING PRIVATE LIMITED,Active
U52231DL2023PTC411348,NXTJET AVIATION PRIVATE LIMITED,Active
U62099RJ2023PTC086387,PXDP SOFT PRIVATE LIMITED,Active
U70200GJ2023OPC139271,WINWINSYNERGY ATINDIA (OPC) PRIVATE LIMITED,Active
U51909PB2022PTC057510,CLARITY MED TECH PRIVATE LIMITED,Active
U65929RJ2022PLN084710,TAPANSHI MUDRA NIDHI LIMITED,Active
U70200DL2023PTC411722,FUNDSTANK FORTUNE PRIVATE LIMITED,Active
U74999UP2022PTC174814,VIDHANKUSH TECHNOLOGIES PRIVATE LIMITED,Active
U45500MP2022PTC063722,GIANT CARE SOLUTIONS PRIVATE LIMITED,Active
U93090HR2023PTC109374,INFINITA LAB INDIA PRIVATE LIMITED,Active
U70200KL2023OPC080941,MIND BREWERY INNOVATION (OPC) PRIVATE LIMITED,Active
U85499OD2023PTC042642,ORRISA EDUCATION COUNSELLOR PRIVATE LIMITED,Active
U62020HR2023PTC111182,GIXCS IT CONSULTING SERVICES PRIVATE LIMITED,Active
U35201HR2023PTC110728,PRAYRAK BIO GAS INDUSTRIES PRIVATE LIMITED,Active
U81100HR2023PTC111141,CROSSKY IMMIGRATION PRIVATE LIMITED,Active
U63910AP2023OPC110797,PVNMS MEDIA (OPC) PRIVATE LIMITED,Active
U52292TN2023PTC160422,ALLWIN MOVERS PRIVATE LIMITED,Active
U60200GA2023PTC015995,WORLD PEACE MEDIA AND BROADCASTING PRIVATE LIMITED,Active
U43900DL2023PTC413720,J MOTI CONSTRUCTION PRIVATE LIMITED,Active
U85499DL2023PTC412974,RAMPOTEACH PRIVATE LIMITED,Active
U46901DL2023PTC415407,WINJET ENTERPRISES PRIVATE LIMITED,Active
U62013MP2023PTC065762,CODEFODE TECHNOLOGIES PRIVATE LIMITED,Active
U47711HR2023PTC113267,LAPARAEL FASHION PRIVATE LIMITED,Active
U52241HR2023PTC113444,ECOSOLVE LOGITECH PRIVATE LIMITED,Active
U62099UP2023PTC186205,LEADS ENSUREDIT PRIVATE LIMITED,Active
U55101DL2023PTC417572,RK.B. HOSPITALITY & CATERING PRIVATE LIMITED,Active
U21002TN2023PTC161271,AAPEX HEALTH SCIENCES PRIVATE LIMITED,Active
U10799HR2023PTC111656,1ST FRONTIER FOODS PRIVATE LIMITED,Active
U21003DL2023PTC415692,HIMALAYAN AYURVEDIC HERBS INDIA PRIVATE LIMITED,Active
U14201TS2023PTC176169,ASIKAR SOLUTIONS PRIVATE LIMITED,Active
U47219DL2023PTC417719,S&O INDIGENOUS IMPEX PRIVATE LIMITED,Active
U42101UT2023PTC016138,BRISTAL INFRA PRIVATE LIMITED,Active
U68100PB2023PTC059587,VKB LAND CONSULTANT AND CONTRACTORS PRIVATE LIMITED,Active
U85307AS2023PTC025111,AFFINITY CLASS PRIVATE LIMITED,Active
U62099KA2023PTC176767,TAVAS SOFTWARE PRIVATE LIMITED,Active
U58201TN2023PTC163660,S2B EDUTECH PRIVATE LIMITED,Active
U62099GA2023OPC016067,INVICTISSIMUS MAGUS (OPC) PRIVATE LIMITED,Active
U58203HR2023PTC113862,APPEASE TECHNOLOGY PRIVATE LIMITED,Active
U47912HR2023OPC113697,DHAAGADIARIES (OPC) PRIVATE LIMITED,Active
U68100HR2023PTC116296,B5 PROCON HOLDING PRIVATE LIMITED,Active
U79110TS2023PTC178955,RIR TRAVEL AND HOLIDAYS PRIVATE LIMITED,Active
U68200HR2023PTC115646,MULTIPLY11 ASSETS PRIVATE LIMITED,Active
U35201TS2023PTC178349,NYBES AMFLIND PRIVATE LIMITED,Active
U41001WB2023PTC265830,BAANGLAR HOUSE PROPERTY PRIVATE LIMITED,Active
U64920RJ2023PTC090857,ARNAVGRAMIN MICROFINANCE PRIVATE LIMITED,Active
U36000HR2023PTC115917,TEKUNO SANAS INDIA PRIVATE LIMITED,Active
U86900GJ2023PTC146009,RECUREME TECHNOLOGY PRIVATE LIMITED,Active
